Semi-Supervised Approach to Monitoring Clinical Depressive Symptoms in Social Media,Depression,Detect depressive symptoms through tweets,Text,2017,IEEE/ACM International Conference on Advances in Social Networks Analysis and Mining,1,Twitter posts of 4000 users (2000 with self-reported depression symptoms and 2000 random users who do not have depression terms in their profile descriptions),N,Twitter posts,1,N,,Tested on a statistical model using a hybrid approach that combines a lexicon-based technique with a semi-supervised topic modeling technique,"- A Large-Scale Dataset for Motivational Dialogue
System : An Application of Natural Language
Generation to Mental Health (https://ieeexplore.ieee.org/stamp/stamp.jsp?tp=&arnumber=9533924)",https://arxiv.org/pdf/1710.05429,Depression - Archive
A Corpus Analysis of Social Connections and Social Isolation in Adolescents Suffering from Depressive Disorders,Depression,Identify topics relevant to social connection and isolation by analyzing clinicla notes from in-patients with depression diagnosis,Text,2017,CLPsych,1,145 clinical notes,N,Clinical notes of in-patients with depression diagnosis,N/A,Y,,,,https://aclanthology.org/W17-3103.pdf,Depression - Archive
RSDD,Depression,Identify self-harm risk in support forums and detect users with self-reported depression on general forums,Text,2017,EMNLP,2 (1 is CLPsych'16 dataset),"RSDD (Reddit): 9,210 diagnosed users + 107,274 controls; avg 969 posts/user (median 646), mean 148 tokens/post",Controlled access (data use agreement): ir.cs.georgetown.edu/resources/rsdd.html,Reddit posts,1,N,,,,https://aclanthology.org/D17-1322.pdf,Depression - Archive
Identifying depression on Reddit: the effect of training data,Depression,Identifying depression from linguistics data,Text,2018,EMNLP,6,,https://github.com/Inusette/Identifying-depression,Reddit posts,1,N,,,,https://aclanthology.org/W18-5903.pdf,Depression - Archive
eRisk 2018,Depression,Early detection of signs of depression,Text,2018,CLEF,1,Train: 106 users; Test: 749 users,N,Social Media user profiles (unclear which specific Social Media website),Multiple (as in multiple posts & comments from one user),N,,,"- Language and Mental Health: Measures of Emotion Dynamics from Text as Linguistic Biosocial Markers;
- Detecting Depression in Social Media using Fine-Grained Emotions;
- A Psychologically Informed Part-of-Speech Analysis of Depression in Social Media",https://www.researchgate.net/publication/319137207_eRISK_2017_CLEF_Lab_on_Early_Risk_Prediction_on_the_Internet_Experimental_Foundations,Depression - Archive
Cross-cultural differences in language markers of depression online,Depression,Explore cultural differences in online language data of users with depression,Text,2018,CLPsych,1,"conversations of 1,593 users",N,"Conversations from 7 Cups of Tea, an anonymous online, chat-based peer support community for emotional distress",multiple,N,,LIWC & topic modeling,,https://aclanthology.org/W18-0608.pdf,Depression - Archive
Detecting Linguistic Traces of Depression in Topic-Restricted Text: Attending to Self-Stigmatized Depression with NLP,Depression,Using ML algorithms to detect depression both with and without depression-related cues,Text,2018,LCCM,1,"12,106 Reddit user, totaling 149,089,719 words; 4,947 depressed users and 7,159 non-depressed users",N,Reddit posts,1,N,,,,https://aclanthology.org/W18-4102.pdf,Depression - Archive
https://www.isca-archive.org/interspeech_2018/huang18e_interspeech.pdf,,,,2018,,,,,,,,,,,,Depression - Archive
https://www.isca-archive.org/interspeech_2018/ozkanca18_interspeech.pdf,,,,2018,,,,,,,,,,,,Depression - Archive
eRisk 2019,Depression,Measuring the severity of the signs of depression,Text,2019,CLEF,1,20 Users,,Users social media posts and questionnaires filled out by them (derived from the Beck's Depression Inventory),Multiple (as in multiple posts & comments from one user),N,,,,https://erisk.irlab.org/2019/index.html,Depression - Archive
Depressed Individuals Use Negative Self-Focused Language When Recalling Recent Interactions with Close Romantic Partners but Not Family or Friends,Depression,Explore how the linguistic profile of depression differs by type of relationship,Text,2019,CLPsych,1,221 students' survey answers,N,Online survey done by Texas Tech University undergraduates enrolled in a general psychology course,N/A,N,,,,https://aclanthology.org/W19-3008.pdf,Depression - Archive
https://www.isca-archive.org/interspeech_2019/rutowski19_interspeech.pdf,,,,2019,,,,,,,,,,,,Depression - Archive
eRisk 2020,Depression,,Text,2020,CLEF,,70 Users,,,,,,,,,Depression - Archive
D2S,Depression,Identify depressive symptomps in tweets using he auxiliary task of figurative usage detection,Text,2020,COLING,1,"5,000 users - 12,155 tweets, with 3738 tweets annotated with 9 PHQ-9 symptom classes",N,Twitter posts,1,Y,,,,https://aclanthology.org/2020.coling-main.61.pdf,Depression - Archive
https://www.isca-archive.org/interspeech_2020/tao20_interspeech.pdf,,,,2020,,,,,,,,,,,,Depression - Archive
Gender and Racial Fairness in Depression Research using Social Media,Depression,Use social media data to see if mental health diagnosis has a gender or racial bias,Text,2021,,2,"CLPsych - 475 depression users, 475 control group, 900 total users, 3000 most recent tweets from each user, and Multitask - 1400 depression users, 1400 control",,Twitter posts,,N,,,,https://aclanthology.org/2021.eacl-main.256.pdf,Depression - Archive
eRisk 2021,Depression,Early risk prediction on the Internet,Text,2021,CLEF,,80 Users,,,,,,,- Explainable Depression Detection Using Large Language Models on Social Media Data,,Depression - Archive
MotiVAte,Depression (Major Depressive Disorder),"A large-scale dataset that consists of dyadic conversations between a depressed user and a virtual assistant (VA) (imparting hope and motivation), aiming to help ",Text,2021,International Joint Conference on Neural Networks (IJCNN),1,4000 dialogues,N,conversations scraped from www.psychcentral.org,multiple,Y - consulted a psychiatrist for creating guidelines for modifying the conversations,,Tested on seq2seq model and HRED model with MLE objective and RL objective,,https://ieeexplore.ieee.org/stamp/stamp.jsp?tp=&arnumber=9533924,Depression - Archive
A Dataset for Research on Modelling Depression Severity in Online Forum Data,Depression,Focus on depression severity evaluation from online forum data,Text,2021,International Conference Recent Advances in Natural Language Processing (RANLP),1,not mentioned,N,Forum posts from 1) Beyond Blue Online Forum 2) Understand Forum 3) 7 Cup Forum 4) Depression Forums,multiple,Y - annotated by two psychological experts,,,,https://aclanthology.org/2021.ranlp-srw.20.pdf,Depression - Archive
D^4,Depression,"a Chinese dialogue dataset simulating authentic doctor-patient consultations following clinical guidelines (ICD-11, DSM-5)",Text,2022,EMNLP,1,1339 dialogues,Available upon request https://x-lance.github.io/D4/,Simulated patient-doctor conversations,multiple,Y - guidance of psychiatrists during data collection,,,,https://aclanthology.org/2022.emnlp-main.156.pdf,Depression - Archive
DepSign – LT-EDI @ ACL 2022,Depression,Classify social media posts into depression severity,Text,2022,LT-EDI Workshop @ ACL 2022,1,"16,632 posts — Train 8,891, Dev 4,496, Test 3,245; class totals: Not 4,649, Moderate 10,494, Severe 1,489",Participant download via CodaLab,Reddit posts,1,N,,OPI; RoBERTa ensemble,,https://aclanthology.org/2022.ltedi-1.51.pdf,Depression - Archive
EATD Corpus,Depression,For automatic depression detection,Audio + Text,2022,ICASSP,1,162 students: 30 depressed and 132 non-depressed; overall duration of 2.26 hours response audios ,https://github.com/speechandlanguageprocessing/ICASSP2022-Depression,Interviews conducted by a virtual interviewer,Multiple,N (but an SDS questionnaire was used to differentiate depressed and non-depressed participants),"Accuracy, Recall, Precision, and F1 score",BiLSTM and GRU,https://www.isca-archive.org/interspeech_2025/liang25_interspeech.pdf,https://arxiv.org/pdf/2202.08210,Depression - Archive
https://www.isca-archive.org/interspeech_2022/fara22_interspeech.pdf,,,,2022,,,,,,,,,,,,Depression - Archive
https://www.isca-archive.org/interspeech_2022/lamichhane22_interspeech.pdf,,,,2022,,,,,,,,,,,,Depression - Archive
https://www.isca-archive.org/interspeech_2022/wang22q_interspeech.pdf,,,,2022,,,,,,,,,,,,Depression - Archive
https://www.isca-archive.org/interspeech_2022/rutowski22_interspeech.pdf,,,,2022,,,,,,,,,,,,Depression - Archive
eRisk 2023,Depression,Early risk prediction on the Internet,Text,2023,CLEF,1,"3,807,114 sentences",Possibly available upon request,Social Media posts,1,N,,,- Explainable Depression Detection Using Large Language Models on Social Media Data,https://erisk.irlab.org/2023/index.html,Depression - Archive
DepSign – LT-EDI @ RANLP 2023,Depression,Classify social media posts into depression severity,Text,2023,LT-EDI Workshop @ RANLP 2023,1,"10,945 posts — Train 7,201, Dev 3,245, Test 499; class counts (Train/Dev/Test): Not 2755/848/136, Moderate 3678/2169/275, Severe 768/228/88",Participant download via CodaLab,Reddit posts,1,N,"Accuracy, Recall, Precision, and F1 score",DeepLearningBrasil; RoBERTa/DeBERTa ensembles,,https://aclanthology.org/2023.ltedi-1.4.pdf,Depression - Archive
The Androids Corpus,Depression,Depression detection from speeches,Audio,2023,Interspeech,1,"118 native Italian speakers (64 diagnosed with depression, 54 as control participants)",https://github.com/androidscorpus/data,Audios of 1) reading task and 2) interview task,multiple,Y,accuracy,Two baseline approaches used,,https://www.isca-archive.org/interspeech_2023/tao23_interspeech.pdf,Depression - Archive
A Novel Technique for Detecting Depressive Disorder: A Speech Databse-Based Approach,Depressive disorder,Automatic Depression Detection (ADD) via speech,Audio,2023,International Conference of the IEEE Engineering in Medicine & Biology Society (EMBC),1,58 Subjects,N,Speech samples in the Indic Bengali language,1,Y - assess by a clinical psychiatrist,"Accuracy, Recall, Precision, and F1 score",,Investigation of Layer-Wise Speech Representations in Self-Supervised Learning Models: A Cross-Lingual Study in Detecting Depression,https://ieeexplore.ieee.org/stamp/stamp.jsp?tp=&arnumber=10341118,Depression - Archive
Thai-Maywe,Depression,Depression detection using multi-modal information,Text + Audio + Visual,2023,AAAI Summer Symposium Series,1,83 participants' audio recordings; 21 with facial data,N,Questionnaire questions and freeform questions,1,Y - a medical professional is observing each participants as they use the application,,,https://www.isca-archive.org/interspeech_2025/prakrankamanant25_interspeech.pdf,https://ojs.aaai.org/index.php/AAAI-SS/article/view/27465/27238,Depression - Archive
"A Multimodal Investigation of Speech, Text, Cognitive and Facial Video Features for Characterizing Depression With and Without Medication",Depression,Characterize depression severity and antidepressant use effects using a cloud-based multimodal dialog system; explore which features differ by severity and by medication status,"Audio, Text, Facial Video",2023,Interspeech,1,269 participants (118 no-med; 151 med),N,"Multimodal recordings: read/automatic/spontaneous speech; facial landmarks; ASR transcripts; cognitive task scores (word recall, digit spans), sampled at 44.1 kHz audio",1,N,"precision, recall, accuracy, AUC",Internal 5-fold CV (random forest) on same dataset; no external benchmark,,https://www.isca-archive.org/interspeech_2023/campbell23_interspeech.pdf,Depression - Archive
"Bayesian Networks for the robust and unbiased prediction of depression and
its symptoms utilizing speech and multimodal data",MDD,"Jointly predict MDD and individual symptoms using a multimodal Bayesian Network; handle missing data, fuse modalities, and reduce demographic bias","Audio, Facial",2023,Interspeech,1,"1,336 participants after exclusions",N,"mage Description (video + speech), Paragraph Reading (read speech), n-Back cognitive game",1,N,ROC-AUC,Stratified 5-fold CV on the same dataset; internal comparisons (AUC reported); no external benchmark,,https://www.isca-archive.org/interspeech_2023/fara23_interspeech.pdf,Depression - Archive
"Diverse Perspectives, Divergent Models: Cross-Cultural Evaluation of Depression Detection on Twitter",Depression,Audit cross-cultural generalization of Twitter depression-detection models; introduce a geo-located cross-country evaluation set,Text,2024,NAACL,3 (CLPsych 2015 depression; “MTL” Twitter depression; new cross-cultural evaluation set),"Training sources: CLPsych train/val: 327/150 depressed, 570/301 controls; MTL train/val: 1,520/320 depressed, 1,520/320 controls. Evaluation set (new): 531 users (267 depressed, 264 controls) from 7 countries.","Evaluation set: GroupLens page (research use): https://grouplens.org/datasets/twitter-depression-dataset-2024/
 • CLPsych 2015: shared-task data (application/agreements) • MTL: prior Twitter depression dataset (see paper).",Social media (Twitter/X) user timelines (English); geo-located users,1,Evaluation set disclosures manually verified by human raters (κ=0.65); phrases originally vetted by psychologists in prior work referenced by authors.,"F1 Score (F1), Recall, ",paper benchmarks LR vs. MentalLongformer trained on CLPsych/MTL,,https://aclanthology.org/2024.naacl-short.58.pdf,Depression - Archive
Clinically-Labelled with Individual symptoms of Depression (CLIND) dataset,Depression,Explore using self-supervised embeddings for detecting depression,Audio,2024,Interspeech,1,25471 segments,N,Speech samples of participants who were asked to speak about their experiences from the past few weeks with different prompts,1,Y - rated by trained clinicians using the MADRS,"Root Mean Square Error (RMSE), Macro F-score",,,https://www.isca-archive.org/interspeech_2024/dumpala24b_interspeech.pdf,Depression - Archive
Depression Enhances Internal Inconsistency between Spoken and Semantic Emotion: Evidence from the Analysis of Emotion Expression in Conversation,Depression,Study the consistency between spoken and semantic emotion in depressed patients,Audio,2024,Interspeech,1,"210 participants: 68 mild depressed, 72 moderate depressed, and 70 healthy",N,Interviews with a psychiatrist or psychologist,Multiple,Y - diagmosed by a professional psychiatrist,"ANOVA,correlation",,,https://www.isca-archive.org/interspeech_2024/wu24j_interspeech.pdf,Depression - Archive
Reference Interval Dataset,Major Depressive Disorder,Show the value of RI-derived features for MDD detection,Audio,2025,Interspeech,3,,N,,1,N,,,,https://www.isca-archive.org/interspeech_2025/white25b_interspeech.pdf,Depression - Archive
Emotion-Guided Graph Attention Networks for Speech-Based Depression Detection under Emotion-Inducting Tasks,Depression,Explore depression detection from speech produced under emotion-inducing tasks through graph attention networks ,Audio,2025,Interspeech,1,"70 with depression, 70 healthy; each participant produced 5 recordings -> 840 speech samples total",N,Speech samples from 2 emotion-inducing tasks 1) text reading and 2) picture description,1,N (but the 70 participants with depression have been diagnosed according to the paper),"precision, recall, accuracy and F1-Score",GAT and transformer-based models,,https://www.isca-archive.org/interspeech_2025/zhou25f_interspeech.pdf,Depression - Archive
Vocal Mind dataset (VMD),Depression,Analyze the application of test-time training (TTT) to improve the robustness of depression detection against distributional shifts,Audio,2025,Interspeech,1,speech samples from 559 (401 female and 158 male) participants; train: 417 (307 female and 110 male) recordings; test: 142 (94 female and 48 male) recordings,N,Participants prompted to speak about their experiences from the past few weeks,1,N,Macro F-score,"wav2vec 2.0, HuBERT and wavLM",,https://www.isca-archive.org/interspeech_2025/dumpala25_interspeech.pdf,Depression - Archive
Towards the Objective Characterisation of Major Depressive Disorder Using Speech Data from a 12-week Observational Study with Daily Measurements,Major Depressive Disorder,Explore associations between depression symptom severity and 38 acoustic and cognitive features from longitudinal data ,Audio,2025,Interspeech,1,3374 clean audio sessions from 71 participants,N,"longitudinal speech, collected daily for 12 weeks",1,Y - weekly HDRS scores are collected by clinicians,The evaluation relies on clinicians and the participants themselves for establishing the depression status and severity ,,,https://www.isca-archive.org/interspeech_2025/lewis25_interspeech.pdf,Depression - Archive
Can Speech Accurately Detect Depression in Patients with Comorbid Dementia? An Approach for Mitigating Confounding Effects of Depression and Dementia,Depression,Detect depression from speech in patients with and without comorbid dementia; mitigate dementia confounding via Wasserstein-distance feature masking,Audio,2025,Interspeech,1,"416 participants (167 healthy, 41 depression-only, 167 cognitive-decline only, 41 both)",N,Read speech (“Grandfather Passage”),1,Cognitive decline diagnosed by clinicians; depression via PHQ-9 (self-report),"precision, recall, accuracy and F1-Score","Internal baselines (SVM, LSTM) + comparison to MLA; 5-fold CV on same dataset; no external benchmark",,https://www.isca-archive.org/interspeech_2025/young25_interspeech.pdf,Depression - Archive
"Linguistic Analaysis of the Speech Output of the Schizophrenic, Bipolar, and Depressive patients","bipolar disorder, schizophrenia, depression","see if BD, MDD, or SZ are falsely diagnosed as being the other mental illness (BD was found to have to most misdiagnoses)",transcription,2002,Karger,1,"484 subjects, 186 diagnosed SZ, 187 BD, and 111 MDD",N,speech recordings,1,N,,,https://aclanthology.org/2024.lrec-main.1133.pdf,https://karger.com/psp/article-pdf/35/4/220/3488653/000063831.pdf,Bipolar (Medha)
Quantifying Mental Health Signals in Twitter,"depression, bipolar, PTSD, SAD","use Twitter data, analyze self expression of mental diagnosis",text,2014,ACL,1,"bipolar - 992k tweets, depression. - 1m tweets, PTSD - 573k tweets, SAD - 421k tweets, Control - 13.7m tweets",data from twitter API from 2008-2013,twitter posts,,N,"ROC. Precision, Pearson’s correlation (r) ",,,https://aclanthology.org/W14-3207.pdf,Bipolar (Medha)
Distress Analysis Corpus of human and computer interviews,"for PTSD/depression, but can be used for any",create a corpus with different types of interviews for analysis,"audio, video, and depth sensor recordings of interviews",2014,LREC,1,621 interviews ,"shared on a case by case basis, can request access",videos,1,Y,accuracy,,,http://www.lrec-conf.org/proceedings/lrec2014/pdf/508_Paper.pdf,Bipolar (Medha)
From ADHD to SAD: Analyzing the Language of Mental Health on Twitter through Self-Reported Diagnoses,"ADHD, Anxiety, Bipolar, Borderline, Depression, Eating, OCD, PTSD, Schizophrenia, Seasonal Affective",Explore language differences between ten conditions with respect to 1) the general population and 2) to each other,text,2015,ACl - CLPsych,11,# of users; median number of tweets; total for each condition,N,"Twitter posts (self-reported, between 2008-2015)",1,N,,Character n-gram language model classifiers,,https://aclanthology.org/W15-1201.pdf,Bipolar (Medha)
The Language of mental health problems in social media,"addiction, anxiety, asperger's, autism, bipolar, dementia, depression, schizophrenia, self harm, suicide ideation",study language features that are characteristic for individual mental health conditions using large scale data,text,2016,ACL - CLPsych,2 - comments and posts,3m comments and posts,"Y -  https://redd.it/
3mg812 (posts), https://redd.it/3bxlg7 (comments)",Reddit posts/comments,,,Accuracy,,,https://aclanthology.org/W16-0307.pdf,Bipolar (Medha)
UMD Reddit Suicidality Dataset,suicide risk,,text,2018,ACL - CLPsych,,,,reddit posts,,,,,,,Bipolar (Medha)
Turkish Audio Visual Bipolar Disorder Corpus,bipolar disorder,create an annotated corpus for bipolar disorder state classification,video,2018,ACII Asia,1,"51 patients (male, female)",available upon request,recordings,multiple,Y,UAR,,-https://ieeexplore.ieee.org/stamp/stamp.jsp?tp=&arnumber=9320154. -https://link.springer.com/article/10.1007/s10044-021-01001-y,https://www.researchgate.net/publication/327852885_The_Turkish_Audio-Visual_Bipolar_Disorder_Corpus,Bipolar (Medha)
SMHD - A large scale resource for exploring online language usage for multiple mental health conditions ,"ADHD, anxiety, autism, bipolar, borderline, depression, ocd, ptsd, schizophrenia, seasonal affective depression",,text,2018,ACL,1,"115,000k posts",Self-Reported Mental Health Diagnoses (SMHD) dataset,reddit posts,multiple,,"Precision (P), Recall (R), and F1 score",,,https://aclanthology.org/C18-1126.pdf,Bipolar (Medha)
Searching Brazilian Twitter for signs of mental health issues,"depression, anxiety, bipolar, panic disorders",,text,2020,LREC,1,"224 users, 616,369 messages",N,brazil twitter posts,,,"Precision (P), Recall (R), and F-score (F). Linguistic analysis relied on Welch’s t-test with Bonferroni correction for statistical significance, quantified by Cohen’s d statistic to measure effect size ",,,https://aclanthology.org/2020.lrec-1.750.pdf,Bipolar (Medha)
Suicidal Ideation and Mental Disorder Detection with Attentive Relation Networks,"Suicidal Ideation, Depression, Bipolar, PTSD",Detect suicidal ideation and mental disorders with related risk indicators using relation networks (equipped with the attention mechanism to prioritize more critical relational features),text,2021,Neural Computing and Applications,"3 (one public dataset, one firstly collected, one combined from several existing data sources), the one in this row is from Twitter",4800 tweets,https://www.cs.jhu.edu/~mdredze/datasets/clpsych_shared_task_2015/ request from this link,Twitter,,N,accuracy and the weighted average F-score metric (F1 score),,,https://arxiv.org/pdf/2004.07601,Bipolar (Medha)
Reddit SWMH Dataset,"Suicidal Ideation, Depression, Anxiety, Bipolar",,text,2021,Neural Computing and Applications,,"54,412 posts",https://www.reddit.com/dev/api,Reddit posts,1,N,,,,,Bipolar (Medha)
Understanding who uses Reddit: profiling individuals with a self reported bipolar disorder diagnosis,bipolar disorder,see which types of individuals identify themselves as being bipolar on reddit,text,2021,ACL,1,all reddit posts until 2019 downloaded,"Y - reddit API, user id retrieved using https://github.com/praw-dev/praw",reddit posts,multiple,N,Accuracy (correct/total) and Coverage (predicted/total),,,https://aclanthology.org/2021.clpsych-1.1.pdf,Bipolar (Medha)
Classification of mental illnesses on social media using RoBERTa,"depression, anxiety, bipolar, ADHD, PTSD",automate mental health detection,text,2021,ACL,1,17159 posts,https://github.com/amurark/mental-health-classification,reddit posts,,N,"Precision (P), Recall (R), F1 score, and Accuracy (Acc)",,,https://aclanthology.org/2021.louhi-1.7.pdf,Bipolar (Medha)
Towards Intelligent Clinically Informed Language Analyses of people with Bipolar Disorder and Schizophrenia,"Bipolar Disorder, Schizophrenia",Identify lignuistic correlates between diagnostic groups of schizophrenia and bipolar,transcript/feature data (numerical),2022,ACL - EMNLP,1,644 subjects (1288 transcript),Y - https://github.com/ankitaich09/EMNLP_2022,"SSPA (Social Skills Performance Assessment), a conversation between a participant and examiner",,Y,,,,https://aclanthology.org/2022.findings-emnlp.208.pdf,Bipolar (Medha)
Twitter-STMHD: An Extensive User-Level Database of Multiple Mental Health Disorders,"3 Depressive Disorders including Depression, Major-Depressive Disorder (MDD), Post-Partum Depression (PPD); PTSD, AHDH, Anxiety, Bipolar, OCD ","1) Instead of being a corpus of tweets, a collection of user-profiles that can be used to analyze temporal information 2) Captures the tweeting acivity of users suffering from mental health disorders during COVID",text,2022,AAAI Conference on Web and Social Media,1,25860 unique user profiles who belong to at least one of the 8 disorder categories; 8000 control user profiles,https://zenodo.org/records/6409736,Twitter user profiles and posts,Multiple (as in multiple posts from one user),N,,,- Language and Mental Health: Measures of Emotion Dynamics from Text as Linguistic Biosocial Markers,https://ojs.aaai.org/index.php/ICWSM/article/view/19368/19140,Bipolar (Medha)
"Symptom Identification for intepretable detection of multiple mental disorders on social media, Dataset called ""PySym""",general/all,identify symtpoms of mental disorders through social media posts,text,2022,ACL - EMNLP,1,8554 reddit post sentences,Code at https://github.com/blmoistawinde/EMNLP22-PsySym Dataset can be provided upon request,reddit posts,,Y,,,,https://aclanthology.org/2022.emnlp-main.677.pdf,Bipolar (Medha)
Identifying moments of change from longitudinal user text,general/all,identifying moments of change in peoples lives and how that relates to predicting mental health disorders,text,2022,ACL,1,"12.3 M posts, 1.1M user",need permission,posts from talklife.com,,Y,,,,https://aclanthology.org/2022.acl-long.318.pdf,Bipolar (Medha)
"From Stigma to Support: A Parallel Monolingual corpus and NLP approach for neutralizing mental illness bias, Dataset is called ""Mental Illness Neutrality Corpus""",general/all,neutralizing mental illness bias with accuracy of 98%,text,2023,ACL,1,5500+ phrases/pieces of text,https://github.com/masonchoey/from-stigma-to-support,sentence pairs,,N,,,,https://aclanthology.org/2023.ranlp-1.28.pdf,Bipolar (Medha)
