Public Speaking Anxiety Corpus ,Anxiety (specifically related to public speaking) ,Develop a vast multimodal dataset to support research in detecting and assessing public speaking ability using multimodal data,audio + video + text,2016,LREC 2016 ,1,180 speech presentations with annotated features (such as gazing or pausing),Available upon request ,Speech presentations ,1,"Yes, experts were the ones evaluating the pre-presentations and the post-presentations ",regression r,multimodal features consistently yielded the best performance,,https://aclanthology.org/L16-1078.pdf,Anxiety (manasi)
DAIC dataset,"Psychological distress: anxiety, depression, and PTSD",Develop a distress analysis interview corpus ,audio + video + text,2014,LREC 2014,1,189 recorded sessions ,https://dcapswoz.ict.usc.edu/,Interviews with multimodal data ,1,Yes this dataset includes clinical interviews carried out under controlled conditions ,human rater,Multimodal Effectiveness: ,,http://www.lrec-conf.org/proceedings/lrec2014/pdf/689_Paper.pdf,Anxiety (manasi)
LGBTeens Reddit Dataset,"Mental health challenges among queeer youth including depression, anxiety, and suicidal ideation ","Assess whether LLMs can serve as emotional supporters for queer youth, comparing their responses to those from humans ",text,2024,NAACL-HLT 2024,1,Not specifically mentioned ,https://github.com/nitaytech/LGBTeenDataset,Reddit posts ,1,No ,Human and Automatic Evaluation: evaluators holding academic degrees. GPT-3.5 and GPT-4 ,LLMs,,https://aclanthology.org/2024.naacl-long.113.pdf,Anxiety (manasi)
ALBA: Adaptive Language-Based Assessments for Mental Health,Depression and Anxiety ,Generate new openended questions based on previous responses(specifically for messages that have tones of depression and/or anxiety),text,2024,NAACL-HLT 2024,1,"69,864 responses to mental health questions",No,Free text responses from participants ,,"No, while the scales are clinically validated, there is no clinical verification on the annotations (that is self reported) ","Pearson correlation (r) against CTT-based ""true"" scores (PHQ-9/GAD-7) and IRT-based ""most informative"" latent scores","compared two adaptive methods against several fixed-order and adaptive baselines using two psychometric measurement theories: Classical Test Theory (CTT) and Item Response Theory (IRT).
",,https://aclanthology.org/2024.naacl-long.136.pdf,Anxiety (manasi)
Alex Street Counseling and Psychotherapy Transcripts,"Anxiety, depression, schizophrenia, and suicidal ideation",Introduce WAT model to assess therapeutic working alliance (the goal agreement between a given therapist and patient),text,2024,ClinicalNLP 2024,1,950+ therapy sessions ,,Transcripts from therapy sessions,,Yes these transcripts are taken from a session with a licensed therapist ,classification=accuracy,"Transformer, WA-LSTM",,https://aclanthology.org/2024.clinicalnlp-1.6.pdf,Anxiety (manasi)
PERSONA-CHAT dataset,Xenoglossophobia (foreign-language anxiety),Develop a personalized language-learning platform to see if it can alleviate language anxiety in learners ,text,2022,LREC 2022 ,1,8784 transcripts ,https://www.kaggle.com/datasets/atharvjairath/personachat,Conversation data in the form of text for people who are learning a foreign language ,,No,"hits@1 score, perplexity","Transformer chat bot is used, Spearman Correlation for feature analysis",,https://aclanthology.org/2022.lrec-1.132.pdf,Anxiety (manasi)
Talkspace Dataset ,Anxiety ,Analyze linguistic complexity in mental health online therapy messages ,text,2021,NAACL 2021,1,"30,437 survey responses (7170 clients)",,Text-based therapy messages and corresponding survey responses ,,No (privacy reasons) ,,"Linear Mixed Model Analysis, z score, t test",,https://aclanthology.org/2021.naacl-main.352.pdf,Anxiety (manasi)
Automatic detection of psychological distress indicators and severity assessment from online forum posts,"depression, PTSD, mild traumatic brain injury",analyze forum posts by veterans and caretakers,text,2012,COLING,1,"not specified, but 136 labels used to annotate",N,social media posts,,N,,,,https://aclanthology.org/C12-1145.pdf,PTSD(Medha)
Wizard of Oz dataset ,PTSD,explore presence of indicators of psychological distress in the linguistic behavior of subjects,transcription,2013,SIGDIAL,1,64 participants,N,"questionnaires, interview",multiple,,,,,https://aclanthology.org/W13-4032.pdf,PTSD(Medha)
Quantifying Mental Health Signals in Twitter,"depression, bipolar, PTSD, SAD","use Twitter data, analyze self expression of mental diagnosis",text,2014,,1,"bipolar - 992k tweets, depression. - 1m tweets, PTSD - 573k tweets, SAD - 421k tweets, Control - 13.7m tweets",data from twitter API from 2008-2013,twitter posts,,,,,,https://aclanthology.org/W14-3207.pdf,PTSD(Medha)
Distress Analysis Corpus of human and computer interviews (DAIC),"for PTSD/depression, but can be used for any",create a corpus with different types of interviews for analysis,"audio, video, and depth sensor recordings of interviews",2014,LREC,1,621 interviews (contains 4 types of interviews),"shared on a case by case basis, can request access",Interviews,1,Y,,,,http://www.lrec-conf.org/proceedings/lrec2014/pdf/508_Paper.pdf,PTSD(Medha)
"SimSensei Kiosk, E-DAIC dataset (extended distress analysis corpus of human and computer and computer interviews","depression, anxiety, PTSD",analyze non verbal and verbal interactions between patients and virtual and non virtual interviewers,video,2014,AAMAS,1,"120 face to face interviews in phase 1, 140 participant interactions (WOZ study) in phase 2",N,interview (virtual and in person),,Y,,,https://aclanthology.org/2024.findings-emnlp.23.pdf,https://www.ccs.neu.edu/home/marsella/publications/pdf/Devault_AAMAS14.pdf,PTSD(Medha)
CLPsych 2015 Shared Task: Depression and PTSD on Twitter,"Depression, PTSD","Modeling language relevant to mental health from
social media",text,2015,CLPsych,1,"Train: 327 depression users, 246 PTSD, and an age- and gender-matched control for each. Total: 1,146; Test: 150 depression users,
150 PTSD, and an age- and gender-matched
control for each. Total: 600. Each user has 3000 posts.",N but might be able to get it? https://www.cs.jhu.edu/~mdredze/clpsych-2015-shared-task-evaluation/,Twitter posts,1,N,,,"- MentalBERT: Publicly Available Pretrained LMs for Mental Healthcare;
- Deep Learning for Depression Detection of Twitter Users (https://aclanthology.org/W18-0609.pdf)",https://aclanthology.org/W15-1204.pdf,PTSD(Medha)
From ADHD to SAD: Analyzing the Language of Mental Health on Twitter through Self-Reported Diagnoses,"ADHD, Anxiety, Bipolar, Borderline, Depression, Eating, OCD, PTSD, Schizophrenia, Seasonal Affective",Explore language differences between ten conditions with respect to 1) the general population and 2) to each other,text,2015,CLPsych,11,# of users; median number of tweets; total for each condition - 403; 3241; 1251k,N,"Twitter posts (self-reported, between 2008-2015)",1,N,,,,https://aclanthology.org/W15-1201.pdf,PTSD(Medha)
"SMHD: A Large-Scale Resource for Exploring Online Language Usage
for Multiple Mental Health Conditions","ADHD, Anxiety, Bipolar, Borderline, Depression, Eating, OCD, PTSD, Schizophrenia, Seasonal Affective",create a dataset with users of multiple mental health conditions,text,2018,International Conference on Computational Linguistics,1,36948 diagnosed users,N,reddit posts,,Y,,,,https://aclanthology.org/C18-1126.pdf,PTSD(Medha)
"In an Absolute State: Elevated Use of Absolutist Words Is a Marker Specific to Anxiety, Depression, and Suicidal Ideation","Anxiety, Depression, PTSD, Schizophrenia, Bipolar, Suicidal Ideation",To determine if the use of absolutist thinking is strongly coorelated with instances of the aformentioned mental health disorders,text,2018,APS,1,63 different social media forums,Y - https://figshare.com/articles/dataset/Stats_-_In_an_Absolute_State_xlsx/4743547?file=7749943 (the analysis of the data) There is a link to the text files but it leads to nothing.,Social media posts,,,,,https://aclanthology.org/W19-3010.pdf?trk=public_post_comment-text,https://journals.sagepub.com/doi/10.1177/2167702617747074,PTSD(Medha)
Dreaddit: A Reddit Dataset for Stress Analysis in Social Media,Stress/PTSD,Identify stress from lengthy multi-domain social media data,text,2019,International Workshop on Health Text Mining and Information Analysis (LOUHI),1,"3553 labeled data points from 2929 posts (1857 ""stressful"")",https://www.cs.columbia.edu/~eturcan/data/dreaddit.zip,"Reddit posts (from 10 subreddits in five domains: abuse, social, anxiety, PTSD and financial)",1,N,,,,https://aclanthology.org/D19-6213/,PTSD(Medha)
"Detection of Mental Health Conditions from Reddit via Deep
Contextualized Representations","schizophrenia, bipolar, borderline personality disorder, PTSD, eating disorder, depression, anxiety, OCD",collect data and build classifiers to distinguish between disorders; both user and post-level classification.,text,2020,11th International Workshop on Health Text Mining and Information Analysis (ACL workshop),1,17.5M posts,Julia and SI worked on it,Reddit posts,,,,,,https://aclanthology.org/2020.louhi-1.16.pdf,PTSD(Medha)
"Social media data as a a lens onto care-seeking behavior among women
veterans of the US armed forces",PTSD,use social media data to get information on support seeking individuals in the US army,text,2020,NLPCSS,1,"3m tweets from 20,000 twitter users",N,twitter posts,,,,,,https://aclanthology.org/2020.nlpcss-1.20.pdf,PTSD(Medha)
"Cluster Analysis of Online Mental Health Discourse using Topic-Infused
Deep Contextualized Representations",PTSD,"investigate reddit discourse on PTSD and complex PTSD, elicit thematic clusters and qalitatively analyze each cluster",text,2021,International Workshop on Health Text Mining and Information nalaysis,1,"24,390 posts",r/ptsd: reddit.com/r/ptsd    r/CPTSD: reddit.com/r/CPTSD     pushsift API (used to get all posts from these subreddits): pushift.io     filter out non english: pypi.org/project/pycld2/0.24/      text cleaning: pypi.org/project/pycontractions/ ,reddit posts,,N,,,,https://aclanthology.org/2021.louhi-1.10.pdf,PTSD(Medha)
Classification of mental illnesses on social media using RoBERTa,"depression, ADHD, PTSD, anxiety, bipolar",,text,2021,International Workshop on Health text mining and information Analysis,1,"17159 posts, 13 subreddits",https://github.com/amurark/mental-health-classification,reddit posts,,Y,,,,https://aclanthology.org/2021.louhi-1.7.pdf,PTSD(Medha)
Predicting PTSD symptom trajectories from AI based language analysis,PTSD,demonstrate the value of AI in understanding PTSD in a vulnerable population,text,2021,Pyschological Medicine,1,124 responders at Stony Brook WTC Health and Wellness program evaluated after 9/11,,oral interview,,,,,,https://static1.squarespace.com/static/53d29678e4b04e06965e9423/t/5ff88088da7f643bf514e819/1610121388396/2021+WTC+oral+histories+preprint.pdf,PTSD(Medha)
Reddit SWMH Dataset,"Suicidal Ideation, Depression, Anxiety, Bipolar",,text,2022,Neural Computing and Applications,,"54,412 posts",,Reddit posts,1,N,,,,,PTSD(Medha)
Twitter Datasets Collection,"Suicidal Ideation, PTSD",,text,2022,Neural Computing and Applications,,4800 tweets,Some of it available upon request (https://www.cs.jhu.edu/~mdredze/datasets/clpsych_shared_task_2015/),Twitter posts,1,N,,,,,PTSD(Medha)
Twitter-STMHD: An Extensive User-Level Database of Multiple Mental Health Disorders,"3 Depressive Disorders including Depression, Major-Depressive Disorder (MDD), Post-Partum Depression (PPD); PTSD, AHDH, Anxiety, Bipolar, OCD ","1) Instead of being a corpus of sweets, a collection of user-profiles that can be used to analyze temporal information 2) Captures the tweeting acivity of users suffering from mental health disorders during COVID",,2022,AAAI Conference on Web and Social Media,1,25860 unique user profiles who belong to at least one of the 8 disorder categories; 8000 control user profiles,https://zenodo.org/records/6409736,Twitter user profiles,Multiple (as in multiple posts from one user),N,,,- Language and Mental Health: Measures of Emotion Dynamics from Text as Linguistic Biosocial Markers,https://ojs.aaai.org/index.php/ICWSM/article/view/19368/19140,PTSD(Medha)
MotiVAte dataset,"PTSD, MDD, anxiety, OCD",create a virtual assistant as a first point of contact and comfort for mental health patients,text,2022,ACL: human Language Technologies,1,"7067 dialogues (4046 MDD, 1000 OCD, 1000 Anxiety, 1021 PTSD)",N,peer to peer support forum www.psychcentral.org,multiple,Y,,,,https://aclanthology.org/2022.naacl-main.174.pdf,PTSD(Medha)
SMHD-GER: A Large-Scale Benchmark Dataset for Automatic Mental Health Detection from Social Media in German,"Schizophrenia, ADHD, Bipolar, Depression, Anxiety, OCD, PTSD",Create a large dataset of German social media posts written by people with these various MHCs,text,2023,EACL ,1,5611 different diagnosed users,N,Social media posts,,,,,,https://aclanthology.org/2023.findings-eacl.113.pdf,PTSD(Medha)
C2D2 Dataset (in Chinese),"depression, PTSD",determine prevalence of cognitive distortion in social media posts from individuals with depression or PTSD,text,2023,EMNLP,1,7500 cognitive distortion (patterns of irrational thinking that can lead to distorted perceptions on reality) thoughts,https://github.com/bcwangavailable/C2D2-Cognitive-Distortion,thoughts,,Y,,,,https://aclanthology.org/2023.findings-emnlp.680.pdf,PTSD(Medha)
Automating PTSD Diagnostics in Clinical Interviews: Leveraging Large language Models for Trauma Assessments,PTSD,aid clinicians in diagnostic validation using data from clinical interviews,transcription,2024,ACL,1,411 interviews conducted with 366 participants,N - unable to be released,clinical interviews,,Y,,,,https://aclanthology.org/2024.sigdial-1.55.pdf,PTSD(Medha)
The Language of Trauma: Modeling Traumatic Even Descriptions Across Domains with Explainable AI***,PTSD,use RoBERTa to predict traumatic events ,text,2024,EMNLP,4,mixed,https://github.com/MiriamSchirmer/trauma-language,mixed,,Y,,,,https://aclanthology.org/2024.findings-emnlp.773.pdf,PTSD(Medha)
MentalHelp: A Multi-Task Dataset for Mental Health in Social Media,"depression, PTSD, schizophrenia, and eating disorders","To create a large, semi-supervised data set of social media posts to help identify mental disorders",text,2024,LREC-COLING,1,14 million instances,https://github.com/mraihan-gmu/MentalHelp,Social media posts,,N,,,,https://aclanthology.org/2024.lrec-main.977.pdf,PTSD(Medha)
Suicidal Ideation and Mental Disorder Detection with Attentive Relation Networks,"Suicidal Ideation, Depression, Anxiety, Bipolar, PTSD",Detect suicidal ideation and mental disorders with related risk indicators using relation networks (equipped with the attention mechanism to prioritize more critical relational features),,mixed,mixed,"3 (one public dataset, one firstly collected, one combined from several existing data sources)",,,,,,,,,https://arxiv.org/pdf/2004.07601,PTSD(Medha)
"PTSD in the Wild: A Video Database for Studying
Post-Traumatic Stress Disorder Recognition in
Unconstrained Environments",PTSD,analyze PTSD patients using computer vision,video,2024,HAL open science,1,"317 videos of PTSD subjects, 317 control",http://www.lissi.fr/PTSD-Dataset/,video,,,,,,https://hal.science/hal-04794169v1/file/2209.14085v1.pdf,PTSD(Medha)
FEMH Dataset,PTSD,deep transfer learning approach to differentiate pathological voice samples from normal ones,audio,2019,IEEE ,1,200 patients,,voice signal,,,,,,https://ieeexplore.ieee.org/stamp/stamp.jsp?tp=&arnumber=8622447,PTSD(Medha)
AURORA Study,"PTSD, depreesion, post concussion syndrome",provide a dataset capable of helping to address trauma aftermath,"neuroimaging, neurocognitive assessments",2020,Mol Psychiatry,1,5000 participants,,neurocognitive tests,,,,,,https://pmc.ncbi.nlm.nih.gov/articles/PMC6981025/pdf/nihms-1535896.pdf,PTSD(Medha)
"The effect of clinical intervention on the speech of individuals with PTSD:
features and recognition performances",PTSD,"PTSD detection based on speech
recordings",audio,2023,Interspeech,1,"15 participants, all female",,audio recordings before and after clinical intervention,,,,,,https://www.isca-archive.org/interspeech_2023/kathan23_interspeech.pdf,PTSD(Medha)
"Speech-Based Assessment of PTSD in a Military Population
using Diverse Feature Classes",PTSD,monitor PTSD in both miliatry and civilian populations,text,2015,Interspeech,1,"39 participants (male), 10-115 min of speech for each participant",,interview,,,,,,https://www.isca-archive.org/interspeech_2015/vergyri15_interspeech.pdf,PTSD(Medha)
Suicidal Ideation and Mental Disorder Detection with Attentive Relation Networks,"Suicidal Ideation, Depression, Anxiety, Bipolar, PTSD",Detect suicidal ideation and mental disorders with related risk indicators using relation networks (equipped with the attention mechanism to prioritize more critical relational features),text,mixed,mixed,"3 (one public dataset, one firstly collected, one combined from several existing data sources)",,No ,,,,Accuracy and weighted average F-score,model  integrating both sentiment and topic risk indicators achieved the best performance,,https://arxiv.org/pdf/2004.07601,Suicidal (Manasi)
UMD Reddit Suicidality Dataset,Suicide Ideation,,text,2018,CLPsych,1,Train: 620 users; Test: 245 users,Available upon request (https://psresnik.github.io/umd_reddit_suicidality_dataset.html),Reddit posts,"- Suicidal Ideation and Mental Disorder Detection with Attentive Relation Networks 
- MentalBERT: Publicly Available Pretrained Language Models for Mental Healthcare",1,,,Some annotated by experts,,Suicidal (Manasi)
Large Scale Analysis of Counseling Conversations: An Application of NLP to Mental Health,"depression, self harm, suicidal thoughts, anxiety, etc",study conversations with counselors using LLMs to see how these conversations can be improved ,text,2016,TACL,1,"80,885 conversations, 3.2 million messages, 408 counselors",https://snap.stanford.edu/counseling/,SMS conversations with counselor service,,,ROC AUC ,Nested models are used to incrementally add features outperforn,,https://aclanthology.org/Q16-1033.pdf,Suicidal (Manasi)
The Language of mental health problems in social media,"addiction, anxiety, asperger's, autism, bipolar, dementia, depression, schizophrenia, self harm, suicide ideation",study language features that are characteristic for individual mental health conditions using large scale data,text,2016,CLPsych,2 - comments and posts,3m comments and posts,"Y -  https://redd.it/
3mg812 (posts), https://redd.it/3bxlg7 (comments)",Reddit posts/comments,,,accuracy,,,https://aclanthology.org/W16-0307.pdf,Suicidal (Manasi)
"In an Absolute State: Elevated Use of Absolutist Words Is a Marker Specific to Anxiety, Depression, and Suicidal Ideation","Anxiety, Depression, PTSD, Schizophrenia, Bipolar, Suicidal Ideation",To determine if the use of absolutist thinking is strongly coorelated with instances of the aformentioned mental health disorders,text,2018,APS,1,63 different social media forums,Y - https://figshare.com/articles/dataset/Stats_-_In_an_Absolute_State_xlsx/4743547?file=7749943 (the analysis of the data) There is a link to the text files but it leads to nothing.,Social media posts,https://aclanthology.org/W19-3010.pdf?trk=public_post_comment-text,,"Prevalence percentage (""index"") of absolutist and LIWC dictionaries",Interpretability is achieved by analyzing the prevalence of explicit linguistic features and quantified sentiment/happiness patterns across different mental health communities,,https://journals.sagepub.com/doi/10.1177/2167702617747074,Suicidal (Manasi)
Curating a Large-Scale Motivational Interviewing Dataset Using Peer Support Forums,"Depression, Anxiety, Suicidal",Study the extent to which conversational data from peer support platforms align with real therapeutic conversations and discuss in what ways they can be exploited to train therapeutic chatbots.,text,2022,International Conference on Computational Linguistics,2,~17k listeners' utterances annotated,Y - https://github.com/anuradha1992/Motivational-Interviewing-Dataset,Counseling dialogues,,multiple,Inter-rater agreement (Fleiss’ Kappa),n/a,,https://aclanthology.org/2022.coling-1.293.pdf,Suicidal (Manasi)
The First Multilingual Model For The Detection of Suicide Texts,Suicidal Ideation. ,Develop a multilingual transformer model for detecting suicidal content across multiple languages,text,2025,SUMEval-2 2025,1,2068 Spanish tweets (translated into 6 other languages),https://github.com/kvvaldez/spanish_suicide,Tweets,,No,"F1-score (F1.), and Area Under the ROC Curve (AUC","mT5 displayed superior performance across all metrics and languages,  ",,https://aclanthology.org/2025.sumeval-2.1.pdf,Suicidal (Manasi)
Lexicography Saves Lives (LSL): Automatically Translating Suicide-Related Language,Suicidal ideation/content,Evaluate how well LLMs handle suicidal content,text,2025,COLING 2025,1,Seed dictionary from O'Dea et. al,No ,Tweets,,No ,"Aggregated average scores for Adequacy, Fluency, and Cultural/Contextual acceptability",n/a,,https://aclanthology.org/2025.coling-main.213.pdf,Suicidal (Manasi)
AMI (Augmented Multi-party Interaction) Meeting Corpus,Clinical conversations including in regards to suicide,Summarizing clinical conversations and using evaluation metrics ,Audio + video,2019,RECITAL 2019,1,,https://www.idiap.ch/webarchives/sites/www.amiproject.org/ami-scientific-portal/meeting-corpus.html,Recordings of conversations,,Yes,n/a,n/a,,https://aclanthology.org/2019.jeptalnrecital-recital.3.pdf,Suicidal (Manasi)
"UMD Reddit Suicidality Dataset, Version 2",Suicidal Ideation,Various,Text,2019,CLPsych 2019,1,,https://psresnik.github.io/umd_reddit_suicidality_dataset.html,Reddit posts ,,No,n/a,n/a,,Various,Suicidal (Manasi)
Emonet Dataset,,Introduce model that uses temporal emotion calculated from the timeline of users' tweets in the past,Text,2021,EACL 2021,1,"84,181 audio recordings",https://github.com/EIHW/EmoNet,Tweets,,No,"Macro F1 and Recall. accuracy,",PHASE significantly outperformed all baseline,,https://aclanthology.org/2021.eacl-main.205.pdf,Suicidal (Manasi)
Multi-Task Learning for Mental Health using Social Media Text,Suicidal risk and overall mental health risks,Detecting suicidal risk and overall mental health risk,Text,2016,NAACL 2016,1,554 users ,No ,Tweets,,No ,n/a,n/a,,https://m-mitchell.com/NAACL-2016/CLPsych/pdf/CLPsych11.pdf,Suicidal (Manasi)
A Chatbot for Providing Suicide Prevention Information in Spanish,Suicidal ideation,Creating a chatbot to help those with suicidal thoughts (Spanish),Text,2025,International Workshop on Spoken Dialogue Systems Technology,1,2048 chat segments ,No ,Chat segments ,,Yes (all documents were classified and inspected by experts),"Rouge, BLEU, and BertScore ",Aya Expanse was selected as the best overall model ,,https://aclanthology.org/2025.iwsds-1.21.pdf,Suicidal (Manasi)
Design of a conversational agent to support people on suicide risk,Suicidal ideation,"Develop a conversational agent
designed to detect suicide risk factors during
real-time chat interactions",Text,2025,International Workshop on Spoken Dialogue Systems Technology,1,"339 participants divided in three distinct groups: a clinical, a clinical control and a general control populations","https://clinicaltrials.gov/study/NCT06341634?locStr=Vigo,%20Municipality%20of%20Vigo,%20Spain&country=Spain&city=Vigo&cond=Suicide%20Ideation&rank=1#study-record-dates",Answers to screening questions,,Yes  ,"Accuracy (overall and by category), Precision, Recall, and F1-score ",Few-shot Prompting achieved the best results ,,https://aclanthology.org/2025.iwsds-1.13.pdf,Suicidal (Manasi)
CLPsych 2025 dataset,Suicidal Ideation ,Various,Text,2025,,1,,Request/enter?: https://clpsych.org/shared-task/,Text,,No,n/a,n/a,,Various,Suicidal (Manasi)
CLPsych 2022 dataset,Suicidal Ideation ,Various,Text,2022,,1,,Request: https://github.com/stuartemiddleton/uos_clpsych,Text,,No,n/a,n/a,,,Suicidal (Manasi)
TalkLife Dataset,Suicidal Ideation,Analyze and predict timelines of posts ,Text,2023,EACL 2023,1,12.3 million posts between August 2011 and August 2020 (for annotation 500 timelines were selected) ,https://github.com/behavioral-data/Empathy-Mental-Health/tree/master/dataset,Text,,Yes (peer-to-peer network),"Precision, Recall, F1","BOCPD models consistently achieved the highest precision and high Medoid Votes (MV) across both the TalkLife and Reddit datasets, particularly for larger margins of error",,https://aclanthology.org/2023.eacl-main.274.pdf,Suicidal (Manasi)
Self-Adapted Utterance Selection for Suicidal Ideation Detection in Lifeline Conversations,Suicidal ideation and risk,Create self-adaptive approach to help determine the most critical utterances of suicidal ideation/thoughts ,Conversation,2023,EACL 2023,1,515 conversations in Taiwanese,On request: https://rec.nccu.edu.tw/main.php,Conversation ,,Yes (multiple times) ,"F-score, Precision (P), and Recall (R)","The proposed self-adaptive method was compared against general deep learning models (BERT/Longformer, GRU) and specialized models like JLPC",,https://aclanthology.org/2023.eacl-main.105.pdf,Suicidal (Manasi)
Sahar Corpus ,Suicidal ideation and risk,Create hierarchical BERT model to detect suicidal ideation ,Chat sessions (conversations) ,2023,EACL 2023,1,"40,000 conversations",No ,Conversation ,,Yes (conversations are with counselors on hotline) ,"Recall, Precision, and F1-score, ROC-AUC, f2",SR-BERT  was benchmarked against strong baselines,,https://aclanthology.org/2023.findings-eacl.184.pdf,Suicidal (Manasi)
