Dataset,Mental Disorder Type,Goal,Modality,Year Published,Venue Published,# Datasets Included,Size,Public? (put link if possible),Data Type,Turn of Spans,Professional Verification,Evaluation Metrics And Method,Benchmark,Cited by,Paper Link,from_sheet
CLPsych 2016 Shared Task: Triaging content in online peer-support forums,Crisis triage including self-harm/suicide risk; depression discussed but not a binary label,Triage forum posts into 4 urgency levels (green/amber/red/crisis),Text,2016,CLPsych 2016,1,"65,024 posts total; 1,227 annotated (train 947 / test 280)",Access by application via organizers,Online peer-support forum (ReachOut.com),1,N,,,,https://aclanthology.org/W16-0312.pdf,Datasets-meta
CLPsych 2017 Shared Task: Reachout Triage,Crisis triage including self-harm/suicide risk,Same as 2016 but with larger dataset,Text,2017,CLPsych 2017,1,"~157,963 posts; 1,588 annotated",Access by application via organizers,Online peer-support forum (ReachOut.com),1,N,,,,,Datasets-meta
CLPsych 2018 Shared Task: Predicting Current and Future Psychological Health from Childhood Essays,"Anxiety, Depression",Predict current (age-11) and future adult distress from age-11 essays,Text,2018,CLPsych 2018,1,">10k essays in cohort; task splits e.g., Age-11 Depression: train 9,146, test 993; adult distress splits in Table 1",Access by application via organizers,Childhood essays,1,"N (measure of psychological health selected was the Bristol Social Adjustment Guide, reported by the participants' teachers)",,,,https://aclanthology.org/W18-0604.pdf,Datasets-meta
CLPsych 2019 Shared Task: Predicting the Degree of Suicide Risk in Reddit Posts (UMD Reddit Suicidality Dataset),Suicide Ideation,Predict user suicide0risk level from Reddit,Text,2019,CLPsych,1,Train: 620 users; Test: 245 users,Available upon request (https://psresnik.github.io/umd_reddit_suicidality_dataset.html),Reddit posts,1,Some annotated by experts,,,"- Suicidal Ideation and Mental Disorder Detection with Attentive Relation Networks 
- MentalBERT: Publicly Available Pretrained Language Models for Mental Healthcare",,Datasets-meta
CLPsych 2021 Shared Task: Community-level Research on Suicidality Prediction in a Secure Environment,Suicide Ideation,Predict suicide attempt (30 days) / death (6 months) from timelines,Text,2021,CLPsych,1,De-identified Twitter timelines; size not public,N,Twitter timelines (user-level),1,N,,,,,Datasets-meta
CLPsych 2022 Shared Task: Capturing Moments of Change in Longitudinal User Posts,Suicidal Ideation,Use longitudinal modeling of the text generated by users overtime to capture mood changes and suicide risk level,Text,2022,CLPsych,1 (but a combination of 3 datasets),"256 timelines, 186 users and 6205 posts",,Reddit posts,1,N,,,,https://aclanthology.org/2022.clpsych-1.16.pdf,Datasets-meta
CLPsych 2024 Shared Task: Utilizing LLMs for finding supporting evidence about an individual's suicide risk level,Suicidal Ideation,Use LLMs to detect individuals' Suicidal Risk Level at both the post level and user level,Text,2024,CLPsych,"1 (but it combines data from 2019 CLPsych Shared Task A and Reddit users and their r/SuicideWatch posts, alongside their suicide risk levels in fourth classes)","245 users, 125 of them annotated; 377 posts, 162 of them annotated",,Reddit posts,1,Y? - annotated by two graduate students in a clinical psychology training program,,,,https://aclanthology.org/2024.clpsych-1.15v2.pdf,Datasets-meta
CLPsych 2025 Shared Task: Capturing Mental Health Dynamics from Social Media Timelines,General mental health,Capture mental health dynamics from social media timelines,Text,2025,CLPsych,1,"train: 30 timelines, 343 posts, 399 adaptive evidences, 526 maladaptive evidences; test: 10 timelines, 94 posts, 145 adapative evidences, 171 maladaptive evidences",,Reddit posts,1,Y? - annotated by two Master's students in clinical psychology,,,,https://aclanthology.org/2025.clpsych-1.16.pdf,Datasets-meta
Towards Intelligent Clinically Informed Language Analyses of people with Bipolar Disorder and Schizophrenia,"Bipolar Disorder, Schizophrenia",Identify lignuistic correlates between diagnostic groups of schizophrenia and bipolar,,2022,EMNLP,1,644 subjects (1288 transcript),Y - https://github.com/ankitaich09/EMNLP_2022,"SSPA (Social Skills Performance Assessment), a conversation between a participant and examiner",,Y - a professional was conducting the conversation,,,,https://aclanthology.org/2022.findings-emnlp.208.pdf,Datasets-meta
"Assessing population-level symptoms of anxiety, depression, and suicide
risk in real time using NLP applied to social media data","Depression, anxiety",Use twitter data to see how health care professionals depression and anxiety levels were changed during the 2020 pandemic,,2020,,1,,,Twitter posts,,,,,,https://aclanthology.org/2020.nlpcss-1.6.pdf,Datasets-meta
From ADHD to SAD: Analyzing the Language of Mental Health on Twitter through Self-Reported Diagnoses,"ADHD, Anxiety, Bipolar, Borderline, Depression, Eating, OCD, PTSD, Schizophrenia, Seasonal Affective",Explore language differences between ten conditions with respect to 1) the general population and 2) to each other,,2015,CLPsych,11,# of users; median number of tweets; total for each condition,N,"Twitter posts (self-reported, between 2008-2015)",1,N,,,,https://aclanthology.org/W15-1201.pdf,Datasets-meta
Suicidal Ideation and Mental Disorder Detection with Attentive Relation Networks,"Suicidal Ideation, Depression, Anxiety, Bipolar, PTSD",Detect suicidal ideation and mental disorders with related risk indicators using relation networks (equipped with the attention mechanism to prioritize more critical relational features),,mixed,mixed,"3 (one public dataset, one firstly collected, one combined from several existing data sources)",,,,,,,,,https://arxiv.org/pdf/2004.07601,Datasets-meta
Reddit SWMH Dataset,"Suicidal Ideation, Depression, Anxiety, Bipolar",,,2022,Neural Computing and Applications,,"54,412 posts",,Reddit posts,1,N,,,,,Datasets-meta
Twitter Datasets Collection,"Suicidal Ideation, PTSD",,,2022,Neural Computing and Applications,,4800 tweets,Some of it available upon request (https://www.cs.jhu.edu/~mdredze/datasets/clpsych_shared_task_2015/),Twitter posts,1,N,,,,,Datasets-meta
Predicting Mental Health Status on Social Media,"N/A, generally looks at mental health",identify user's mental health status through their social media behavior,,2013,Lecture Notes in Computer Science,"1, but the data has 9 different dimensions (SCL-90-R scores have 9 dimensions)",448 subjects,"N, but weibo data can be accessed publicly",Weibo posts (microblog in China),,,,,,https://www.researchgate.net/publication/299705204_Predicting_Mental_Health_Status_on_Social_Media,Datasets-meta
Twitter-STMHD: An Extensive User-Level Database of Multiple Mental Health Disorders,"3 Depressive Disorders including Depression, Major-Depressive Disorder (MDD), Post-Partum Depression (PPD); PTSD, AHDH, Anxiety, Bipolar, OCD ","1) Instead of being a corpus of sweets, a collection of user-profiles that can be used to analyze temporal information 2) Captures the tweeting acivity of users suffering from mental health disorders during COVID",,2022,AAAI Conference on Web and Social Media,1,25860 unique user profiles who belong to at least one of the 8 disorder categories; 8000 control user profiles,https://zenodo.org/records/6409736,Twitter user profiles,Multiple (as in multiple posts from one user),N,,,- Language and Mental Health: Measures of Emotion Dynamics from Text as Linguistic Biosocial Markers,https://ojs.aaai.org/index.php/ICWSM/article/view/19368/19140,Datasets-meta
Large Scale Analysis of Counseling Conversations: An Application of NLP to Mental Health,"depression, self harm, suicidal thoughts, anxiety, etc",study conversations with counselors using LLMs to see how these conversations can be improved ,,2016,TACL,1,"80,885 conversations, 3.2 million messages, 408 counselors",https://snap.stanford.edu/counseling/,SMS conversations with counselor service,,,,,,https://aclanthology.org/Q16-1033.pdf,Datasets-meta
Empowering Mental Health Assessment: A RoBERTa-Based Approach for depression detection ,depression,use social media dataset to create a model for indentifying depression in social media posts,,2023,LT-EDI,1,"7201 subjects, 3245 dev, 499 test",datset from the workshop at this linkhttps://sites.google.com/view/lt-edi-2023/tasks?authuser=0,posts from a variety of social media forums,,,,,,https://aclanthology.org/2023.ltedi-1.13.pdf,Datasets-meta
Quantifying Mental Health Signals in Twitter,"depression, bipolar, PTSD, SAD","use Twitter data, analyze self expression of mental diagnosis",,2014,,1,"bipolar - 992k tweets, depression. - 1m tweets, PTSD - 573k tweets, SAD - 421k tweets, Control - 13.7m tweets",data from twitter API from 2008-2013,twitter posts,,,,,,https://aclanthology.org/W14-3207.pdf,Datasets-meta
Characterizing and Predicting Postpartum Depression from shared Facebook data,post partum depression,"analyze facebook data of moms with PPD, and create statistical model to predict whether or not a mom will have PPD",,2014,,2,"267 complete responses to the survey, 165 responses to PHQ-9 questionnaire",N,"survey to gain access to facebook data, questionnaire",,,,,,https://dl.acm.org/doi/pdf/10.1145/2531602.2531675?casa_token=GwPyfbxeIlUAAAAA:J2Wf0ysmYtd4EWpP-ER8HrOl_Wu57AZ6hdoa2XRPJ7hOH-__lBsp3WblxKSOjK-g_FS6bVi0wVJw,Datasets-meta
The Language of mental health problems in social media,"addiction, anxiety, asperger's, autism, bipolar, dementia, depression, schizophrenia, self harm, suicide ideation",study language features that are characteristic for individual mental health conditions using large scale data,,2016,CLPsych,2 - comments and posts,3m comments and posts,"Y -  https://redd.it/
3mg812 (posts), https://redd.it/3bxlg7 (comments)",Reddit posts/comments,,,,,,https://aclanthology.org/W16-0307.pdf,Datasets-meta
Dreaddit: A Reddit Dataset for Stress Analysis in Social Media,Stress,Identify stress from lengthy multi-domain social media data,,2019,International Workshop on Health Text Mining and Information Analysis (LOUHI),1,"3553 labeled data points from 2929 posts (1857 ""stressful"")",https://www.cs.columbia.edu/~eturcan/data/dreaddit.zip,"Reddit posts (from 10 subreddits in five domains: abuse, social, anxiety, PTSD and financial)",1,N,,,,https://aclanthology.org/D19-6213/,Datasets-meta
Toward Digital Phenotypes of Early Childhood Mental Health via Unsupervised and Supervised Machine Learning,"ADHD, Anxiety, Depression",Detect ADHD/anxiety/depression in children using supervised and clustering techniques,,2023,IEEE Engineering in Medicine & Biology Society (EMBC),1,84,N,Wearable sensor-derived data,,N,,,,https://ieeexplore.ieee.org/document/10340806,Datasets-meta
Trauma Event Recognition Across Contextual Environments (TRACE),Trauma,"Trauma detection, introduces a variety of datasets",,2024,EMNLP Findings,4,,N,,,,,,,https://aclanthology.org/2024.findings-emnlp.773.pdf,Datasets-meta
"Google Form for Students in Bhopal, India","Stress, Anxiety, Depression",Generating summaries of psychological conversations,,2025,31st International Conference on Computational Linguistics (COLING 2025) ,1,405,https://huggingface.co/SIR-Lab/MSE_Summarizer,Google Form Questionnaire Submissions,1,Yes - Done with the presence of 2 certified clinicians,,,,https://aclanthology.org/2025.coling-main.182.pdf,Datasets-meta
ArmanEmo Dataset,"Stress, Anxiety, Depression",Develop culturally sensitive Persian chatbot,,2025,AbjadNLP 2025 (part of COLING 2025),1,7000,https://paperswithcode.com/dataset/armanemo,"Twitter, Instagram, Digikala (Iranian e-commerce company)",1,N,,,,https://aclanthology.org/2025.abjadnlp-1.8.pdf,Datasets-meta
"Linguistic Analaysis of the Speech Output of the Schizophrenic, Bipolar, and Depressive patients","bipolar disorder, schizophrenia, depression","see if BD, MDD, or SZ are falsely diagnosed as being the other mental illness (BD was found to have to most misdiagnoses)",audio to text (transcribed recordings),2002,,1,"484 subjects, 186 diagnosed SZ, 187 BD, and 111 MDD",N,speech recordings,1,N,,,,,Datasets-meta
"Detecting schizophrenia, bipolar disorder, psychosis vulnerability and major depressive disorder from 5 minutes of online collected speech","bipolar disorder, schizophrenia, MDD",see if disorder can be classified using speech,audio,2024,,1,"1140 participants, 22,650 minutes of speech",,speech,,N,,,,,Datasets-meta
"In an Absolute State: Elevated Use of Absolutist Words Is a Marker Specific to Anxiety, Depression, and Suicidal Ideation","Anxiety, Depression, PTSD, Schizophrenia, Bipolar, Suicidal Ideation",To determine if the use of absolutist thinking is strongly coorelated with instances of the aformentioned mental health disorders,text,2018,APS,1,63 different social media forums,Y - https://figshare.com/articles/dataset/Stats_-_In_an_Absolute_State_xlsx/4743547?file=7749943 (the analysis of the data) There is a link to the text files but it leads to nothing.,Social media posts,,,,,https://aclanthology.org/W19-3010.pdf?trk=public_post_comment-text,https://journals.sagepub.com/doi/10.1177/2167702617747074,Datasets-meta
Using LLMs to Aid Annotation and Collection of Clinically-Enriched Data in Bipolar Disorder and Schizophrenia,Schizophrenia and Bipolar,Study effectiveness of using LLMs to annotate mental health data,,2025,,1,644 interviews,Y - https://github.com/ankitaich09/EMNLP_2022,Interviews,,Y - diagnoses were ocnfimed by medical practitioners.,,,,https://aclanthology.org/2025.clpsych-1.15.pdf,Datasets-meta
Towards Intelligent Clinically-Informed Language Analyses of People with Bipolar Disorder and Schizophrenia,Schizophrenia and Bipolar,create dataset of manually transcribed interations with individuals suffereing from bipolar disorder or schizophrenia to study lexical features in those people's speech,,2022,,1,644 interviews,Y - https://github.com/ankitaich09/EMNLP_2022,Interviews,,Y - diagnoses were ocnfimed by medical practitioners.,,,https://aclanthology.org/2025.clpsych-1.15.pdf,https://aclanthology.org/2022.findings-emnlp.208.pdf,Datasets-meta
Distress Analysis Corpus of human and computer interviews (DAIC),"for PTSD/depression, but can be used for any",create a corpus with different types of interviews for analysis,"audio, video, and depth sensor recordings of interviews",2014,LREC,1,621 interviews (contains 4 types of interviews),"shared on a case by case basis, can request access",Interviews,1,Y,,,,http://www.lrec-conf.org/proceedings/lrec2014/pdf/508_Paper.pdf,Datasets-meta
A Bag-of-Users approach to mental health prediction from social media data,Anxiety and Depression ,Understand the importance of both textual and non-textual data when using ML models to help classify mental disorders,,2023,PROPOR 2024,2 (textual dataset and non-textual dataset),"46.8 million Tweets; 18,819 unique users ",No ,Twitter users and their tweets,1,N ,,,,https://aclanthology.org/2024.propor-1.52.pdf,Datasets-meta
SMHD-GER: A Large-Scale Benchmark Dataset for Automatic Mental Health Detection from Social Media in German,"Schizophrenia, ADHD, Bipolar, Depression, Anxiety, OCD, PTSD",Create a large dataset of German social media posts written by people with these various MHCs,,2023,,9,5611 different diagnosed users,N,Social media posts,,,,,,https://aclanthology.org/2023.findings-eacl.113.pdf,Datasets-meta
SMHD,"ADHD, Anxiety, Autism, Bipolar, Borderline, Depression, Eating, OCD, PTSD, Schizophrenia, Seasonal Affective","Investigate the creation of high-precision matching patterns
to identify self-reported diagnoses of nine different mental health conditions",Text,2018,COLING,1,"*too much to list here by category, ref. Table 2 in paper",https://ir.cs.georgetown.edu/data/smhd/,Reddit posts,1,N,,Classification methods were tested,"- Context is Important in Depressive Language: A Study of the Interaction
Between the Sentiments and Linguistic Markers in Reddit Discussions",https://aclanthology.org/C18-1126.pdf,Datasets-meta
CURE: Context- and Uncertainty-Aware Mental Disorder Detection,"depression, eating disorders, sleep disorders, anxiety ","propose a novel approach for detecting mental disorders, and release a question answer dataset",text,2024,,1,6349 user posts,https://github.com/DSAIL-SKKU/CURE-EMNLP-2024,Q&A pairs,,Y,,,,https://aclanthology.org/2024.emnlp-main.994.pdf,Datasets-meta
"From Stigma to Support: A Parallel Monolingual corpus and NLP approach for neutralizing mental illness bias, Dataset is called ""Mental Illness Neutrality Corpus""",general/all,neutralizing mental illness bias with accuracy of 98%,text,2023,,1,5500+ phrases/pieces of text,https://github.com/masonchoey/from-stigma-to-support,sentence pairs,,N,,,,https://aclanthology.org/2023.ranlp-1.28.pdf,Datasets-meta
Curating a Large-Scale Motivational Interviewing Dataset Using Peer Support Forums,"Depression, Anxiety, Suicidal",Study the extent to which conversational data from peer support platforms align with real therapeutic conversations and discuss in what ways they can be exploited to train therapeutic chatbots.,text,2022,International Conference on Computational Linguistics,2,~17k listeners' utterances annotated,Y - https://github.com/anuradha1992/Motivational-Interviewing-Dataset,Counseling dialogues,multiple,,,,,https://aclanthology.org/2022.coling-1.293.pdf,Datasets-meta
"Detection of Mental Health Conditions from Reddit via Deep
Contextualized Representations","schizophrenia, bipolar, borderline personality disorder, PTSD, eating disorder, depression, anxiety, OCD",collect data and build classifiers to distinguish between disorders; both user and post-level classification.,text,2020,11th International Workshop on Health Text Mining and Information Analysis (ACL workshop),1,17.5M posts,Julia and SI worked on it,Reddit posts,,,,,,https://aclanthology.org/2020.louhi-1.16.pdf,Datasets-meta
MotiVAte dataset,"PTSD, MDD, anxiety, OCD",create a virtual assistant as a first point of contact and comfort for mental health patients,text,2022,ACL: human Language Technologies,1,"7067 dialogues (4046 MDD, 1000 OCD, 1000 Anxiety, 1021 PTSD)",N,peer to peer support forum www.psychcentral.org,multiple,Y,,,,https://aclanthology.org/2022.naacl-main.174.pdf,Datasets-meta
Classification of mental illnesses on social media using RoBERTa,"depression, ADHD, PTSD, anxiety, bipolar",,text,2021,International Workshop on Health text mining and information Analysis,1,"17159 posts, 13 subreddits",https://github.com/amurark/mental-health-classification,reddit posts,,Y,,,,https://aclanthology.org/2021.louhi-1.7.pdf,Datasets-meta
PsyVoiD,"Depression, Anxiety",Investigate the relationship between speech and well-being in the context of the COVID-19,Audio,2021,"43rd Annual International Conference of the
IEEE Engineering in Medicine & Biology Society (EMBC)",1,"3,242 segments
from 109 recordings",N,,1,N,,ML algorithms,Zero-Shot Speech-Based Depression and Anxiety Assessment with LLMs,https://ieeexplore.ieee.org/stamp/stamp.jsp?arnumber=9630833,Datasets-meta
Emotional support conversation dataset,anxiety,Towards Emotional Support Dialog Systems,text,2021,ACL,1,"1,300 conversations with 10 topic problems.",Y,Q&A pairs,multiple,N,,,,https://arxiv.org/abs/2106.01144,Datasets-meta
MentalChat16K,"Relationships, Anxiety, Depression, Intimacy, and Family Conflict. ",synthetic conversations between a counselor and a client,text,2025,,,"9,775 conversations with 28+ topic problems.",,Q&A pairs,,,,,"https://arxiv.org/abs/2503.13509#:~:text=,access%20to%20mental%20health%20support",https://huggingface.co/datasets/ShenLab/MentalChat16K,Datasets-meta
AnnoMI,"general counseling topics (health behavior change, addiction, etc.)","133 faithfully transcribed and expert-annotated demonstrations of high- and low-quality motivational interviewing (MI), an effective therapy strategy that evokes client motivation for positive change.",text,2023,Future Internet,,133 faithfully transcribed,,Q&A pairs,,,,,,https://github.com/uccollab/AnnoMI,Datasets-meta
CounseLLMe,,400 simulated mental health counselling dialogues between two state-of-the-art Large Language Models (LLMs).,text,2024,,,400,Y,Q&A pairs,,,,,,https://www.sciencedirect.com/science/article/pii/S2667118225000017,Datasets-meta
Reddit C-SSRS Suicide Datase,potential suicidality,"focuses on suicide risk (ideation, behavior, attempts) in social media.",text,2019,,,"2,181",Y,reddit posts,,,,,,"https://zenodo.org/records/2667859#:~:text=negation%20detection%20to%20create%20a,show%20different%20severity%20of%20suicidal",Datasets-meta
TalkLife,"depression, stress, etc","10,000 forum posts and single responses from TalkLife",text,2020,EMNLP,,"10,000",,Q&A pairs,,,,,,https://github.com/behavioral-data/Empathy-Mental-Health,Datasets-meta
Language use of depressed and depression vulnerable college students,Depression,"study essays written by college students who have been, are, or have never been depressed to see differences in language",Text,2004,,1,"31 currently depressed students, 26 formerly depressed, 67 never depressed",,"surveys, written essays",,,,,,https://www.tandfonline.com/doi/epdf/10.1080/02699930441000030?needAccess=true,Depression - Archive
,,,,2007,,,,,,,,,,,https://pmc.ncbi.nlm.nih.gov/articles/PMC3022333/pdf/nihms262167.pdf,Depression - Archive
,,,,2012,,,,,,,,,,,"http://www.sciencedirect.com/
science/article/pii/S0006322312002636",Depression - Archive
The Psychology of Word Use in Depression Forums in English and in Spanish: Testing Two Text Analytic Approaches,Depression,1) Analysis of linguistic markers and themes by depressed individuals 2) Cross-cultural comparison (English and Spanish),Text,2008,ICWSM,2,,N,Foum posts,1,N,,,,https://www.researchgate.net/publication/221298023_The_Psychology_of_Word_Use_in_Depression_Forums_in_English_and_in_Spanish_Testing_Two_Text_Analytic_Approaches,Depression - Archive
Psychiatry: insights into depression through normative decision-making models,Depression,Discover insights into dperession through decision-making models,,2008,NeurIPS,1,"17 healthy controls, 15 MDD patients",N,Participants' behavior,,N,,,,https://papers.nips.cc/paper_files/paper/2008/file/d04d42cdf14579cd294e5079e0745411-Paper.pdf,Depression - Archive
AVEC 2011,Depression,Automatic recognition and classification of depression severity,"Audio, Video, Text",2011,1st International Workshop on Audio/Visual Emotion Challenge,1,340 sessions; ~10 minutes per participant; 30+ hours of data; ~30 subjects,Available upon request,Audio: recordings to participant speech; Video: recordings of participant face; Text: final PHQ-9 and BDI-II scores per subject (questionnaire scores),1,,,,,,Depression - Archive
CONVERGE,MDD,"To provide a large, clinically-ascertained sample of Chinese women with recurrent MDD, in order to study genetic, clinical and comorbidity patterns in a more homogenous population",Speech,2012,Psychological Medicine,1,1970 female participants,N,,,,,,,,Depression - Archive
AVEC 2013,Depression,Predict a single depression severity score per recording,Audio + Visual,2013,3th International Workshop on Audio/Visual Emotion Challenge,1,150 video clips,Yes for registered participants,"Recordings of participants performing two tasks 1) read aloud an excerpt of the fable ""Die Sonne und der Wind"" 2) respond to one of a number of questions",1,,,,,https://opus.bibliothek.uni-augsburg.de/opus4/frontdoor/deliver/index/docId/72601/file/72601.pdf,Depression - Archive
Linguistic Indicators of Severity and Progress in Online Text-based Therapy for Depression,Depression,Detect depression from online therapy dialogue,Text,2014,CLPsych,1,882 treatment dialogues,N,"Cognitive Behavioral Therapy (CBT) treatment dialogues provided by Psychology Online ((http://www.psychologyonline.
co.uk)",multiple,Y in the sense that conversations are between patients and therapists,,,"- A Large-Scale Dataset for Motivational Dialogue
System : An Application of Natural Language
Generation to Mental Health (https://ieeexplore.ieee.org/stamp/stamp.jsp?tp=&arnumber=9533924)",https://aclanthology.org/W14-3202.pdf,Depression - Archive
AVEC 2014,Depression,Predict a single depression severity score per recording,Audio + Visual,2014,4th International Workshop on Audio/Visual Emotion Challenge,1 (reused AVEC 2013 dataset),300 task recordings,Yes for registered participants,"Recordings of participants performing two tasks 1) read aloud an excerpt of the fable ""Die Sonne und der Wind"" 2) respond to one of a number of questions",1,,,epsilon-SVR with intersection kernel trained using LGBP-TOP features,https://arxiv.org/pdf/2202.08210,https://dl.acm.org/doi/pdf/10.1145/2661806.2661807,Depression - Archive
SAD corpus,Depression,Describe the development of a comprehensive annotation scheme for manually annotating Twitter data for depression,Text,2016,Online Journal of Public Health Informatics,1,9300 tweets,N,Twitter posts,1,N,,,Towards Developing an Annotation Scheme for Depressive Disorder Symptoms: A Preliminary Study using Twitter Data,,Depression - Archive
Monitoring Tweets for Depression to Detect At-risk Users,Depression,Propose an automated system that can identify as-risk users from their Twitter (through both an user-level classifier and a tweet-level classifier),Text,2017,Workshop on Computational Linguistics and Clinical Psychology: From Linguistic Signal to Clinical Reality,3,,,Twitter posts,1,N,,,,https://aclanthology.org/W17-3104.pdf,Depression - Archive
