Detecting bipolar disorder from misdiagnosed major depressive disorder with mood aware mutli task learning,bipolar disorder,create a dataset which differentiates people with BD from people with MDD,Text,2024,NAACL,1,7346 posts written by 1025 users,BD-risk: https://github.com/DSAIL-SKKU/Detecting-BD-from-Misdiagnosed-MDD_NAACL_2024,Reddit Posts,multiple posts from one user,"Y - annotated with researchers knowledgeable in mental health, validated with psyhciatrist and clinical psychologist",,,,https://aclanthology.org/2024.naacl-long.278.pdf,Bipolar (Medha)
Predicitve and Distinctive lingusitic features in schizophrenia bipolar specturm disorders,"bipolar disorder, and schizophrenia",identify distinctive linguistic features in these patient groups and controls,transcription,2024,ACL,1,,N - need permission from Hungary (they got permission to use the Hungarian Database),,,,,,,https://aclanthology.org/2024.lrec-main.1133.pdf,Bipolar (Medha)
"Detecting schizophrenia, bipolar disorder, psychosis vulnerability and major depressive disorder from 5 minutes of online collected speech","bipolar disorder, schizophrenia, MDD",see if disorder can be classified using speech,audio,2024,MedRxiv,1,"1140 participants, 22,650 minutes of speech",,speech,,N,,,,https://www.medrxiv.org/content/10.1101/2024.09.03.24313020v1.full-text,Bipolar (Medha)
Using LLMs to aid annotation and collection of clinically enriched data in BD and schizophrenia,"BD, schizophrenia",clinically annotate a previously known dataset and expand with a model as well,text ,2025,ACL,1,,,interviews,,Y,,,,https://aclanthology.org/2025.clpsych-1.15.pdf,Bipolar (Medha)
PRIORI Dataset,bipolar disorder,look at emotion and moods of bipolar disorder patients,speech,2023,Interspeech,1,1022 calls from 47 subjects,,phone calls ,,,,,,https://www.isca-archive.org/interspeech_2023/niu23b_interspeech.pdf,Bipolar (Medha)
AMoss Interview Dataset,"bipolar disorder, borderline personality disorder",provide insights into automatic screening of BD and BPD,"audio, text",2020,Interspeech,1,62 participants,,interview,,,,,,https://www.isca-archive.org/interspeech_2020/wang20e_interspeech.pdf,Bipolar (Medha)
"Making a Distinction between Schizophrenia and Bipolar Disorder
Based on Temporal Parameters in Spontaneous Speech","bipolar disorder, schizophrenia",look at similarity between bipolar and sz patients,speech,2020,Interspeech,1,40 subjects of BD and SZ,,"interview/survey, asked about their day",,,,,,https://www.isca-archive.org/interspeech_2020/gosztolya20b_interspeech.pdf,Bipolar (Medha)
"Auditory-visual speech perception in bipolar disorder: behavioural data and
physiological predictions",bipolar disorder,analyze bipolar auditory-visual speech ,auditory-visual,2019,Interspeech,1,44 subjects ,,recordings of words,,,,,,https://www.isca-archive.org/avsp_2019/erdener19_avsp.pdf,Bipolar (Medha)
"Objective Assessment of Social Skills Using Automated Language Analysis for
Identification of Schizophrenia and Bipolar Disorder","bipolar disorder, schizophrenia",analyze diagnostic value of speech and language features ,text,2019,Interspeech,1,"87 subjects, 22 controls",,SSPA task (interview task),,,,,,https://www.isca-archive.org/interspeech_2019/voleti19_interspeech.pdf,Bipolar (Medha)
PRIORI Emotion Dataset (subset of PRIORI dataset),bipolar disorder,monitor mood of bipolar disorder patients,speech,2018,Interspeech,1,12 subjects,,interviews/conversation,,,,,,https://www.isca-archive.org/interspeech_2018/khorram18_interspeech.pdf,Bipolar (Medha)
A Bi-pyramid multimodal fusion method for the diagnosis of bipolar disorders,bipolar disorder,utilize sMRI and fMRI data to improve bipolar disorder diagnosis,"fMRI, MPRAGE",2024,"Not specified, Interspeech?",2,91 samples,,fMRI and T1 weighted Anatomical MPRAGE,,,,,,https://arxiv.org/pdf/2401.07571,Bipolar (Medha)
Open fMRI datset,bipolar disorder,,fMRI,2024,Interspeech,1,171 samples,"https://openfmri.org/dataset/
ds000030/",fMRI,,,,,,,Bipolar (Medha)
"Clinical decision support for bipolar depression using large
language models",bipolar disorder,analyzing clinical decision making of llms,text,2024,American College of Neuropsychopharmacology,1,50 case reports,,clinical vignettes,,,"clinician selected the expert-defined optimal first choice, McNemar’s test (for model comparison) and Cochrane’s Q test",,,https://www.nature.com/articles/s41386-024-01841-2,Bipolar (Medha)
Semantic abnormalities in schizophrenia and bipolar disorder: A natural language processing approach,"bipolar disorder, schizophrenia",looking at language abnormalities in bipolar and schizophrenia patients,text,2025,Science Progress (Google Scholar),1,~150 participants,,surveys/assessments,,,"Metric (Perplexity - PPL), Network Metrics, ANOVA, ",,,https://journals.sagepub.com/doi/epub/10.1177/00368504241308309,Bipolar (Medha)
"Towards Understanding Bipolar Disorder Through Social Media and Transformer Models:
Challenges and Insights (RSDD dataset)",bipolar disorder,detecting bipolar disorder using llms,text,2025,medRxiv (Google Scholar),1,9000 participants,,reddit posts,,,,,,https://www.medrxiv.org/content/10.1101/2025.03.05.25323466v2.full.pdf+html,Bipolar (Medha)
Linguistic trajectories of bipolar disorder on social media,bipolar disorder,study language trajectories from 3 to 21 years after diagnosis,text,2025,Cornell University (Google Scholar),1,"200,000 posts",,reddit posts,,not peer reviewed,,,,https://arxiv.org/pdf/2509.10035,Bipolar (Medha)
"Detection of Bipolar Disorder on Social Media Data
Utilizing Biomedical, Clinical and Mental Health
Domain Fine-Tuned Word Embeddings",bipolar disorder,"classifying depression, BD, and control from posts",text,2024,IEEE,1,2700 users,,twitter,,,"Precision, Recall, and F1-Score",,,https://ieeexplore.ieee.org/stamp/stamp.jsp?tp=&arnumber=10628576,Bipolar (Medha)
"Assessing population-level symptoms of anxiety, depression, and suicide
risk in real time using NLP applied to social media data","Depression, anxiety",Use twitter data to see how health care professionals depression and anxiety levels were changed during the 2020 pandemic,text,2020,,1,,,Twitter posts,,,AUC scores,no external comparison,,https://aclanthology.org/2020.nlpcss-1.6.pdf,Anxiety (manasi)
From ADHD to SAD: Analyzing the Language of Mental Health on Twitter through Self-Reported Diagnoses,"ADHD, Anxiety, Bipolar, Borderline, Depression, Eating, OCD, PTSD, Schizophrenia, Seasonal Affective",Explore language differences between ten conditions with respect to 1) the general population and 2) to each other,text,2015,CLPsych,11,# of users; median number of tweets; total for each condition,N,"Twitter posts (self-reported, between 2008-2015)",1,N,"ROC curves, Precision",no external comparison,,https://aclanthology.org/W15-1201.pdf,Anxiety (manasi)
Reddit SWMH Dataset,"Suicidal Ideation, Depression, Anxiety, Bipolar",,text,2022,Neural Computing and Applications,,"54,412 posts",,Reddit posts,1,N,,,,,Anxiety (manasi)
Twitter-STMHD: An Extensive User-Level Database of Multiple Mental Health Disorders,"3 Depressive Disorders including Depression, Major-Depressive Disorder (MDD), Post-Partum Depression (PPD); PTSD, AHDH, Anxiety, Bipolar, OCD ","1) Instead of being a corpus of sweets, a collection of user-profiles that can be used to analyze temporal information 2) Captures the tweeting acivity of users suffering from mental health disorders during COVID",text,2022,AAAI Conference on Web and Social Media,1,25860 unique user profiles who belong to at least one of the 8 disorder categories; 8000 control user profiles,https://zenodo.org/records/6409736,Twitter user profiles,Multiple (as in multiple posts from one user),N,,,- Language and Mental Health: Measures of Emotion Dynamics from Text as Linguistic Biosocial Markers,https://ojs.aaai.org/index.php/ICWSM/article/view/19368/19140,Anxiety (manasi)
Large Scale Analysis of Counseling Conversations: An Application of NLP to Mental Health,"depression, self harm, suicidal thoughts, anxiety, etc",study conversations with counselors using LLMs to see how these conversations can be improved ,text,2016,TACL,1,"80,885 conversations, 3.2 million messages, 408 counselors",https://snap.stanford.edu/counseling/,SMS conversations with counselor service,,,Area Under the ROC Curve (AUC) ,no external comparison,,https://aclanthology.org/Q16-1033.pdf,Anxiety (manasi)
The Language of mental health problems in social media,"addiction, anxiety, asperger's, autism, bipolar, dementia, depression, schizophrenia, self harm, suicide ideation",study language features that are characteristic for individual mental health conditions using large scale data,text,2016,CLPsych,2 - comments and posts,3m comments and posts,"Y -  https://redd.it/
3mg812 (posts), https://redd.it/3bxlg7 (comments)",Reddit posts/comments,,,accuracy,no external comparison,,https://aclanthology.org/W16-0307.pdf,Anxiety (manasi)
Toward Digital Phenotypes of Early Childhood Mental Health via Unsupervised and Supervised Machine Learning,"ADHD, Anxiety, Depression",Detect ADHD/anxiety/depression in children using supervised and clustering techniques,Physiological,2023,IEEE Engineering in Medicine & Biology Society (EMBC),1,84,N,Wearable sensor-derived data,,N,"ROC AUC, True Positive Rate (TPR), False Positive Rate (FPR), and Mean Accuracy",The Depression SVM model (using all features) achieved the highest ROC AUC ,,https://ieeexplore.ieee.org/document/10340806,Anxiety (manasi)
Dreaddit: A Reddit Dataset for Stress Analysis in Social Media,Stress,Identify stress from lengthy multi-domain social media data,text,2019,International Workshop on Health Text Mining and Information Analysis (LOUHI),1,"3553 labeled data points from 2929 posts (1857 ""stressful"")",https://www.cs.columbia.edu/~eturcan/data/dreaddit.zip,"Reddit posts (from 10 subreddits in five domains: abuse, social, anxiety, PTSD and financial)",1,N,"F-score, Precision, and Recall ",The overall highest F-score was achieved by the fine-tuned BERT-base model,,https://aclanthology.org/D19-6213/,Anxiety (manasi)
"Google Form for Students in Bhopal, India","Stress, Anxiety, Depression",Generating summaries of psychological conversations,text,2025,31st International Conference on Computational Linguistics (COLING 2025) ,1,405,https://huggingface.co/SIR-Lab/MSE_Summarizer,Google Form Questionnaire Submissions,1,Yes - Done with the presence of 2 certified clinicians,"ROUGE (ROUGE-1, ROUGE-2, ROUGE-L)",Fine-tuned Pegasus-large achieved the highest ROUGE metrics,,https://aclanthology.org/2025.coling-main.182.pdf,Anxiety (manasi)
ArmanEmo Dataset,"Stress, Anxiety, Depression",Develop culturally sensitive Persian chatbot,text,2025,AbjadNLP 2025 (part of COLING 2025),1,7000,https://paperswithcode.com/dataset/armanemo,"Twitter, Instagram, Digikala (Iranian e-commerce company)",1,N,"Accuracy, Precision, Recall, and F1-Score",XLM-RoBERTa-large achieved the highest F1 score,,https://aclanthology.org/2025.abjadnlp-1.8.pdf,Anxiety (manasi)
ANXIETY-COVID19 Dataset,Severe Anxiety (in relation to COVID-19),Build pipeline to automatically detect tweets with signs of intense/extreme anxiety,text,2021,JEP/TALN/RECITAL 2021,1,1032,https://github.com/echen102/COVID-19-TweetIDs,French language tweets,1,N,"Precision, Recall, and F-measure",Neural network models achieved promising results (average F-measure 0.72,,https://aclanthology.org/2021.jeptalnrecital-taln.21.pdf,Anxiety (manasi)
Custom-labeled conversational corpus of Cognitive Behavioral Therapy (CBT),Depression and Anxiety,Automatically generate context-aware therapeutic responses to cognitive distortions displayed by users,text,2021,4th International Conference on Natural Language and Speech Processing (ICNLSP 2021),1,100,,Annotated text dialogues,,N,"Perplexity, BLEU, and METEOR",no external comparison,,https://aclanthology.org/2021.icnlsp-1.13.pdf,Anxiety (manasi)
Online self help group interactions,Depression and Anxiety,Qualitative discourse analysis of communication patterns in self-help groups,text,2018,PACLIC 32 (2018),1,1922,,Online self-help group posts,1,N,This study used a purely qualitative approach to analyze communicative patterns.,This study used a purely qualitative approach to analyze communicative patterns.,,https://aclanthology.org/Y18-1093.pdf,Anxiety (manasi)
Oncology Dialogue tagging systems,Anxiety and Depression in Cancer Patients,Identify effective parameters and tagsets that could enhance understanding and training in oncological communication,text,2001,The Second SIGdial Workshop on Discourse and Dialogue (SIGDIAL 2001),"4 - CN-LOGIT, Roter Interaction Analysis System (RIAS). Medical Interaction Process System (MIPS), Psychological Medicine Group (PMG) tagsets",,,dialogue transcripts from interactions between healthcare professionals and cancer patients,,Yes - oncological and clinical professionals present for both data collection and annotation,it does not contain computational model benchmarking.,it does not contain computational model benchmarking.,,https://aclanthology.org/W01-1627.pdf,Anxiety (manasi)
Reddit Social Anxiety Dataset,Social Anxiety Disorder,identify and measure the prevalence of emotional and physical symptoms of social anxiety by analyzing Reddit posts using a BART-based multi-label zero-shot classification approach,text,2024,9th Workshop on Computational Linguistics and Clinical Psychology (CLPsych 2024),1,"12,277","r/EDAnonymous, r/addiction, r/alcoholism, r/adhd, r/anxiety, r/autism, r/BipolarReddit, r/bpd, r/depression, r/healthanxiety, r/lonely, r/ptsd, r/schizophrenia, r/socialanxiety, and r/SuicideWatch.",Reddit posts on 15 different sub-reddits,1,N,average zero-shot classification probability score ,"The highest frequency scores (64% to 68%) were registered by ""Fear of being judged negatively,"" ""Anxiety in anticipation of a feared activity or event,"" and ""Intense fear or anxiety during social situations""",,https://aclanthology.org/2024.clpsych-1.11.pdf,Anxiety (manasi)
Detecting a Proxy for Potential Comorbid ADHD in People Reporting Anxiety Symptoms from Social Media Data,"Anxiety, Comorbit ADHD",To explore whether Transformer-based classifiers can detect individuals likely to develop ADHD after initially reporting anxiety,text,2024,9th Workshop on Computational Linguistics and Clinical Psychology (CLPsych 2024),1,17159,"All posts were scraped from the Anxiety and ADHD subreddits from the dates February 16, 2020 to Nov 28, 2022",Reddit posts from subreddits for anxiety and ADHD (for a proxy),1,N,Accuracy,"RoBERTa significantly outperformed baselines, ",,https://aclanthology.org/2024.clpsych-1.14.pdf,Anxiety (manasi)
Dravidian Stress Detection Dataset,"Stress, Anxiety, Depression","To develop supervised machine learning models (e.g., SVM, Random Forest) that can identify stress in short text (likely social media posts) in Tamil and Telugu.",text,2024,"Fourth Workshop on Language Technology for Equality, Diversity, Inclusion (LT‑EDI 2024)",2 - 1 in Tamil and the other in Telugu,6524; 6147,No,Social media posts in Tamil and Telugu,1,N,Accuracy and Macro F1-Score,"Tamil Dataset: The SVM classifier was the best, achieving 98.09% accuracy and a Macro F1-score of 0.98.  Telugu Dataset: The Random Forest algorithm was the best, achieving 99.01% accuracy and a Macro F1-score of 0.99",,https://aclanthology.org/2024.ltedi-1.37.pdf,Anxiety (manasi)
Using Daily Language to Understand Drinking: Multi-Level Longitudinal Differential Language Analysis,Depression and Anxiety,introduction of a sequential forecasting model that leverages language to accurately predict the number of alcoholic drinks a person will consume within a 24-hour window,text,2024,9th Workshop on Computational Linguistics and Clinical Psychology (CLPsych 2024),1,242,No,"Survey responses from US resteraunt and hospitality workers (bartenders, waitresses, etc)",1,N,"Mean Squared Error (MSE), Mean Absolute Error (MAE), Pearson correlation",Document Sequential Transformer (TRNS) achieved the best performance across standard metrics ,,https://aclanthology.org/2024.clpsych-1.10.pdf,Anxiety (manasi)
Quora and Reddit Panic and Anxiety Dataset,Panic and anxiety,analyze a dataset of social media posts to explore linguistic differences between panic and anxiety,text,2024,9th Workshop on Computational Linguistics and Clinical Psychology (CLPsych 2024),1,"1,502 from Quora (526 panic, 976 anxiety posts); 428 from Reddit (187 panic, 241 anxiety posts)",https://github.com/SandraMNE/QRPanicAnxiety,Text-based data from Quora and Reddit,1,N,"F1-weighted, F1-macro, F1-micro, ROC AUC, and MCC (averaged over 10 runs)",The combination of all features (B+L+M+I+W) achieved the best performance:,,https://aclanthology.org/2024.clpsych-1.12.pdf,Anxiety (manasi)
Textual and non-textual dataset for anxiety and depression in Portuguese ,Anxiety and Depression ,Understand the importance of both textual and non-textual data when using ML models to help classify mental disorders,text,2023,PROPOR 2024,2 (textual dataset and non-textual dataset),"46.8 million Tweets; 18,819 unique users ",No ,Twitter users and their tweets,1,N ,"Precision, Recall, F1 score ",BERT outperformed all non-textual models in predicting Depression,,https://aclanthology.org/2024.propor-1.52.pdf,Anxiety (manasi)
Reddit posts from 5 different subreddits ,"depression, anxiety, bipolar disorder, ADHD and PTSD",to classify mental illness posts on social media thereby enabling users to seek appropriate help,text,2021,12th International Workshop on Health Text Mining and Information Analysis (2021),1 (from 5 different subreddits and 1 group in the general reddit),17159 Reddit posts accessed through their API,No,Reddit posts    ,1,N,"Precision, Recall, F1 score, and Accuracy",RoBERTa with posts+titles achieved the highest overall metrics,,https://aclanthology.org/2021.louhi-1.7.pdf,Anxiety (manasi)
"In an Absolute State: Elevated Use of Absolutist Words Is a Marker Specific to Anxiety, Depression, and Suicidal Ideation","Anxiety, Depression, PTSD, Schizophrenia, Bipolar, Suicidal Ideation",To determine if the use of absolutist thinking is strongly coorelated with instances of the aformentioned mental health disorders,text,2018,APS,1,63 different social media forums,Y - https://figshare.com/articles/dataset/Stats_-_In_an_Absolute_State_xlsx/4743547?file=7749943 (the analysis of the data) There is a link to the text files but it leads to nothing.,Social media posts,,,"Multilevel mixed-effects modeling and paired comparisons were used to analyze differences between groups, citing effect sizes (Cohen's d)",no external one,https://aclanthology.org/W19-3010.pdf?trk=public_post_comment-text,https://journals.sagepub.com/doi/10.1177/2167702617747074,Anxiety (manasi)
Predicting Treatment Outcome from Patient Texts: The Case of Internet-Based Cognitive Behavioural Therapy,"Depression, Social Anxiety Disorder, Panic Disorder",To investigate whether text classification techniques applied to patients’ messages during internet-based cognitive behavioral therapy (iCBT) can predict treatment outcomes,text,2021,EACL 2021,1,"6821 patients and 180,017 free texts",No,Text messages from patients in internet-based CBT,1,N,F1 score,"TF-IDF model consistently performed best, ",,https://aclanthology.org/2021.eacl-main.46.pdf,Anxiety (manasi)
Multi-Task Learning for Mental Health using Social Media Text,"Suicide Attempt, anxiety, depression, eating disorder, panic
attacks, schizophrenia, bipolar disorder, and posttraumatic stress disorder (PTSD)",multi-task learning for detecting suicide risk and mental health conditions.,text,2017,EACL 2017,1,~33.8m tweets ,No ,Tweets ,1,N,Area Under the ROC curve (AUC) and True Positive Rate at a False Positive Rate,"The MTL framework consistently yielded the best performance in terms of TPR@FPR across all prediction tasks (Neuroatypicality, suicide, depression, anxiety, eating, panic, schizophrenia, bipolar disorder, and PTSD), highlighting its utility in minimizing false diagnoses",,https://aclanthology.org/E17-1015.pdf,Anxiety (manasi)
Linking Language-based Distortion Detection to Mental Health Outcomes,"Depressed mood, thought disorder, emotional drain/stress, anxiety",empirically evaluate whether language-detected distortions do in fact show connections to expected mental health outcomes over both clinical interviews as well as standard selfreport assessments.,text,2025,CLPsych 2025 ,2,,,Textual self reports ,1,,F1 and AUC,higher rates of distorted thinking patterns generally correspond to greater severity of mental health symptoms,,https://aclanthology.org/2025.clpsych-1.5.pdf,Anxiety (manasi)
A Systematic Evaluation of LLM Strategies for Mental Health Text Analysis: Fine-tuning vs. Prompt Engineering vs. RAG,"depression, anxiety, bipolar disorder, or suicidal ideation","conducting a systematic comparison of three distinct approaches for mental health text classification: prompt engineering (including both zero-shot and few-shot variants), retrieval augmented generation (RAG), and fine-tuning.",text,2025,CLPsych 2025 ,2,,Yes both are publicly available,,1,N ,accuracy and F1 scores (macro),Fine-tuning (FT),,https://aclanthology.org/2025.clpsych-1.14.pdf,Anxiety (manasi)
Exploring BERT-Based Classification Models for Detecting Phobia Subtypes: A Novel Tweet Dataset and Comparative Analysis,Phobia (classified as an anxiety disorder),"• Constructed a novel phobia-related tweet dataset based on self-reported users’ timelines containing 102 phobia subtypes. • Applied systematic pre-processing and stringsearching steps to identify self-reported phobia-affected users. • Evaluated the performance of eight BERTbased models, assessing their capability to identify users with phobias and accurately classify the specific subtype of phobia associated with them",text,2024,LREC-COLING 2024,1,"811,569 tweets",No,,1,N,"F1-score, Precision, Recall, Accuracy","binary: M3 (TextRank with phrases) achieved the highest F1-score, multiclass: M1 (user timeline) achieved the highest F1-score ",,https://aclanthology.org/2024.lrec-main.603.pdf,Anxiety (manasi)
MentalRiskES dataset,"ED, depression, anxiety",To create a publicly available dataset and benchmark baseline models (text classification and regression) to support early detection systems for mental health risk,text,2024,LREC-COLING 2024,1,"45,000 telegram messages ",https://github.com/sinai-uja/corpusMentalRiskES,Messages from public Telegram groups (in Spanish),1,N,"Macro-F1, Macro-Precision, Macro-Recall ","classification: mDeBERTa generally achieved superior Macro-F1 scores, regression: RoBERTa Base was overall superior",,https://aclanthology.org/2024.lrec-main.978.pdf,Anxiety (manasi)
SMHD-GER dataset,"schizophrenia spectrum disorders (schizophrenia), bipolar disorders (bipolar), depressive disorders (depression), anxiety disorders (anxiety), obsessive-compulsive disorders (OCD)",Build and benchmark a German-language mental health detection dataset and models,text,2023,EACL 2023 ,1,"455,060 German reddit posts ",No,posts in German on reddit ,1,N,"Macro F1 score, Precision, Recall ","PsyLing achieved the highest F1 for ADHD and Bipolar, The Hybrid Model performed best for PTSD ",,https://aclanthology.org/2023.findings-eacl.113.pdf,Anxiety (manasi)
Conversational Bots for Psychotherapy: A Study of Generative Transformer Models Using Domain-specific Dialogues,Depression and anxiety,explore model fine-tuning through transfer learning on therapy counseling videos for therapy-based response generation,text + video,2022,BioNLP 2022,2,,,social media posts on Reddit and videos ,1,N,"BLEU-2 score, Qualitative (Human): Expert ratings (1-5 Likert scale) on Communication, ",DialoGPT-TL-BS generally scored highest on BLEU-2 and lexical diversity metrics on both test sets ,,https://aclanthology.org/2022.bionlp-1.27.pdf,Anxiety (manasi)
Searching Brazilian Twitter for signs of mental health issues,"Depression, anxiety, bipolar disorder, and panic disorder ",Evaluate convolutional neural networks (CNNs) and other models for mental health detection in Portuguese.,text,2020,LREC 2020,1,"616,369 messages on Twitter",No,Portuguese tweets,1,N,f1,LR model with tfidf ,,https://aclanthology.org/2020.lrec-1.750.pdf,Anxiety (manasi)
Inferring Social Media Users’ Mental Health Status from Multimodal Information,Broad mental health disorders (specifically mentions depression and anxiety),To use multimodal analysis to classify users' mental health status (healthy vs. unhealtthy and then see if they are at risk for any mental conditions),text + images ,2020,LREC 2020,1,"14,781 Flickr posts (770 unique individuals)",On Flickr API (could use the filters to get the same results),Images and text in English on Flickr ,1,N,F-scores (F-HE and F-MI/F-PREMI,effect size analysis (Cohen’s d) for features.. Neural Network using All Features,,https://aclanthology.org/2020.lrec-1.772.pdf,Anxiety (manasi)
A Counselling Corpus in Cantonese,Anxiety (specifically relating to testing),Create and evaluate a Cantonese chatbot for test anxiety support,text,2020,SLTU 2020,1,436 inputs and 150 chatbot replies ,The corpus is available for research purposes on request to the first author,Messages in Cantonese ,1,N ,accuracy,Word Mover’s Distance (WMD),,https://aclanthology.org/2020.sltu-1.50.pdf,Anxiety (manasi)
PsyMine Dataset,"Depression, anxiety, OCD, Phobic disorders, Panic disorder ",Create the first expert-annotated gold standard corups for mining psychiatric disorder mentions in scientific abstracts,text,2016,LREC 2016 ,1,175 scientific abstracts ,https://www.cl.uzh.ch/en/research-groups/texttechnologies/research/biomed-text-mining/psymine.html,Scientific abstracts,1,Yes - this is explicitly mentioned to be done by experts,expert,,,https://aclanthology.org/L16-1590.pdf,Anxiety (manasi)
